[
  {
    "orderNo": 587,
    "vendor": "Amazon",
    "vendorOrderNo": "?112-6131929-4281069",
    "orderDate": "2025-08-21",
    "paymentMethod": 3005,
    "shippingMethod": "",
    "trackingNumber": "",
    "sku": 239815,
    "qty": 1,
    "received": "8/27/2025 0:00:00",
    "price": 12.7
  },
  {
    "orderNo": 588,
    "vendor": "Amazon",
    "vendorOrderNo": "114-3901778-7848206",
    "orderDate": "2025-08-22",
    "paymentMethod": 3005,
    "shippingMethod": "",
    "trackingNumber": "",
    "sku": 181145,
    "qty": 1,
    "received": "8/23/2025 0:00:00",
    "price": 56.16
  },
  {
    "orderNo": 597,
    "vendor": "Amazon",
    "vendorOrderNo": "112-3772048-5617827",
    "orderDate": "2025-08-27",
    "paymentMethod": 3005,
    "shippingMethod": "",
    "trackingNumber": "",
    "sku": "02IQJG1T",
    "qty": 1,
    "received": "8/29/2025 0:00:00",
    "price": 15.88
  },
  {
    "orderNo": 616,
    "vendor": "Amazon",
    "vendorOrderNo": "114-8904504-5153005",
    "orderDate": "2025-09-16",
    "paymentMethod": 3005,
    "shippingMethod": "",
    "trackingNumber": "",
    "sku": 1009810,
    "qty": 1,
    "received": "9/17/2025 0:00:00",
    "price": -0.57
  },
  {
    "orderNo": 632,
    "vendor": "Amazon",
    "vendorOrderNo": "",
    "orderDate": "2025-11-03",
    "paymentMethod": "",
    "shippingMethod": "",
    "trackingNumber": "",
    "sku": 241022,
    "qty": 1,
    "received": "11/4/2025 0:00:00",
    "price": 37.97
  },
  {
    "orderNo": 677,
    "vendor": "Amazon",
    "vendorOrderNo": "",
    "orderDate": "2026-02-11",
    "paymentMethod": 5933,
    "shippingMethod": "AMAZON",
    "trackingNumber": "",
    "sku": 100489,
    "qty": 1,
    "received": "",
    "price": 0
  },
  {
    "orderNo": 677,
    "vendor": "Amazon",
    "vendorOrderNo": "",
    "orderDate": "2026-02-11",
    "paymentMethod": 5933,
    "shippingMethod": "AMAZON",
    "trackingNumber": "",
    "sku": "N627KS",
    "qty": 1,
    "received": "",
    "price": 0
  },
  {
    "orderNo": 677,
    "vendor": "Amazon",
    "vendorOrderNo": "",
    "orderDate": "2026-02-11",
    "paymentMethod": 5933,
    "shippingMethod": "AMAZON",
    "trackingNumber": "",
    "sku": "PNX55B",
    "qty": 1,
    "received": "",
    "price": 0
  },
  {
    "orderNo": 677,
    "vendor": "Amazon",
    "vendorOrderNo": "",
    "orderDate": "2026-02-11",
    "paymentMethod": 5933,
    "shippingMethod": "AMAZON",
    "trackingNumber": "",
    "sku": "WW7XKR",
    "qty": 1,
    "received": "",
    "price": 0
  },
  {
    "orderNo": 661,
    "vendor": "Belmont Butchery",
    "vendorOrderNo": "",
    "orderDate": "2025-12-15",
    "paymentMethod": "Cash",
    "shippingMethod": "oldmanwalking",
    "trackingNumber": "",
    "sku": 103595,
    "qty": 1,
    "received": "12/15/2025 0:00:00",
    "price": 7.12
  },
  {
    "orderNo": 650,
    "vendor": "Chewy.com",
    "vendorOrderNo": 5061386080,
    "orderDate": "2025-11-29",
    "paymentMethod": 2466,
    "shippingMethod": "fedex",
    "trackingNumber": "",
    "sku": 575794,
    "qty": 1,
    "received": "11/30/2025 0:00:00",
    "price": 14.36
  },
  {
    "orderNo": 654,
    "vendor": "Chewy.com",
    "vendorOrderNo": 5063807250,
    "orderDate": "2025-12-03",
    "paymentMethod": 5933,
    "shippingMethod": "fedex",
    "trackingNumber": "",
    "sku": 100429,
    "qty": 1,
    "received": "12/4/2025 0:00:00",
    "price": 16.97
  },
  {
    "orderNo": 654,
    "vendor": "Chewy.com",
    "vendorOrderNo": 5063807250,
    "orderDate": "2025-12-03",
    "paymentMethod": 5933,
    "shippingMethod": "fedex",
    "trackingNumber": "",
    "sku": 999910,
    "qty": 1,
    "received": "12/4/2025 0:00:00",
    "price": 37.43
  },
  {
    "orderNo": 657,
    "vendor": "Chewy.com",
    "vendorOrderNo": 5066865032,
    "orderDate": "2025-12-08",
    "paymentMethod": 5933,
    "shippingMethod": "fedex",
    "trackingNumber": "",
    "sku": 100429,
    "qty": 1,
    "received": "12/11/2025 0:00:00",
    "price": 16.97
  },
  {
    "orderNo": 667,
    "vendor": "Chewy.com",
    "vendorOrderNo": 5085237420,
    "orderDate": "2026-01-12",
    "paymentMethod": 5933,
    "shippingMethod": "fedex",
    "trackingNumber": "",
    "sku": 575794,
    "qty": 2,
    "received": "1/14/2026 0:00:00",
    "price": 28.73
  },
  {
    "orderNo": 667,
    "vendor": "Chewy.com",
    "vendorOrderNo": 5085237420,
    "orderDate": "2026-01-12",
    "paymentMethod": 5933,
    "shippingMethod": "fedex",
    "trackingNumber": "",
    "sku": 999910,
    "qty": 1,
    "received": "1/14/2026 0:00:00",
    "price": 39.06
  },
  {
    "orderNo": 574,
    "vendor": "Costco Glen Allen",
    "vendorOrderNo": 1222885870,
    "orderDate": "2025-09-11",
    "paymentMethod": 3005,
    "shippingMethod": "",
    "trackingNumber": "",
    "sku": 894679,
    "qty": 1,
    "received": "9/8/2025 0:00:00",
    "price": 65
  },
  {
    "orderNo": 624,
    "vendor": "Costco Glen Allen",
    "vendorOrderNo": "",
    "orderDate": "2025-10-09",
    "paymentMethod": 2466,
    "shippingMethod": "",
    "trackingNumber": "",
    "sku": 952912,
    "qty": 1,
    "received": "10/19/2025 0:00:00",
    "price": 27.98
  },
  {
    "orderNo": 624,
    "vendor": "Costco Glen Allen",
    "vendorOrderNo": "",
    "orderDate": "2025-10-09",
    "paymentMethod": 2466,
    "shippingMethod": "",
    "trackingNumber": "",
    "sku": 954930,
    "qty": 1,
    "received": "10/19/2025 0:00:00",
    "price": 17.98
  },
  {
    "orderNo": 629,
    "vendor": "Costco Glen Allen",
    "vendorOrderNo": 1237247325,
    "orderDate": "2025-11-15",
    "paymentMethod": 2466,
    "shippingMethod": "",
    "trackingNumber": "",
    "sku": 952912,
    "qty": 1,
    "received": "11/14/2025 0:00:00",
    "price": 32.99
  },
  {
    "orderNo": 638,
    "vendor": "Costco Glen Allen",
    "vendorOrderNo": "",
    "orderDate": "2025-11-04",
    "paymentMethod": "",
    "shippingMethod": "",
    "trackingNumber": "",
    "sku": "024719",
    "qty": 1,
    "received": "11/4/2025 0:00:00",
    "price": 9.98
  },
  {
    "orderNo": 638,
    "vendor": "Costco Glen Allen",
    "vendorOrderNo": "",
    "orderDate": "2025-11-04",
    "paymentMethod": "",
    "shippingMethod": "",
    "trackingNumber": "",
    "sku": 141323,
    "qty": 1,
    "received": "11/4/2025 0:00:00",
    "price": 14.98
  },
  {
    "orderNo": 638,
    "vendor": "Costco Glen Allen",
    "vendorOrderNo": "",
    "orderDate": "2025-11-04",
    "paymentMethod": "",
    "shippingMethod": "",
    "trackingNumber": "",
    "sku": 954930,
    "qty": 1,
    "received": "11/4/2025 0:00:00",
    "price": 17.98
  },
  {
    "orderNo": 660,
    "vendor": "Costco Glen Allen",
    "vendorOrderNo": "",
    "orderDate": "2025-12-12",
    "paymentMethod": "Cash",
    "shippingMethod": "oldmanwalking",
    "trackingNumber": "",
    "sku": 954930,
    "qty": 1,
    "received": "12/13/2025 0:00:00",
    "price": 18.98
  },
  {
    "orderNo": 669,
    "vendor": "Costco Glen Allen",
    "vendorOrderNo": "",
    "orderDate": "2026-01-01",
    "paymentMethod": 5933,
    "shippingMethod": "car",
    "trackingNumber": "",
    "sku": 188755,
    "qty": 1,
    "received": "1/12/2026 0:00:00",
    "price": 4.48
  },
  {
    "orderNo": 669,
    "vendor": "Costco Glen Allen",
    "vendorOrderNo": "",
    "orderDate": "2026-01-01",
    "paymentMethod": 5933,
    "shippingMethod": "car",
    "trackingNumber": "",
    "sku": 1919326,
    "qty": 1,
    "received": "1/12/2026 0:00:00",
    "price": 28.48
  },
  {
    "orderNo": 669,
    "vendor": "Costco Glen Allen",
    "vendorOrderNo": "",
    "orderDate": "2026-01-01",
    "paymentMethod": 5933,
    "shippingMethod": "car",
    "trackingNumber": "",
    "sku": 194643,
    "qty": 1,
    "received": "1/12/2026 0:00:00",
    "price": 20.98
  },
  {
    "orderNo": 669,
    "vendor": "Costco Glen Allen",
    "vendorOrderNo": "",
    "orderDate": "2026-01-01",
    "paymentMethod": 5933,
    "shippingMethod": "car",
    "trackingNumber": "",
    "sku": 954930,
    "qty": 1,
    "received": "1/12/2026 0:00:00",
    "price": 18.98
  },
  {
    "orderNo": 611,
    "vendor": "Costco Midlothian",
    "vendorOrderNo": 1222886710,
    "orderDate": "2025-09-08",
    "paymentMethod": 3005,
    "shippingMethod": "",
    "trackingNumber": "",
    "sku": "000860",
    "qty": 1,
    "received": "9/12/2025 0:00:00",
    "price": 3.96
  },
  {
    "orderNo": 611,
    "vendor": "Costco Midlothian",
    "vendorOrderNo": 1222886710,
    "orderDate": "2025-09-08",
    "paymentMethod": 3005,
    "shippingMethod": "",
    "trackingNumber": "",
    "sku": 522965,
    "qty": 1,
    "received": "9/12/2025 0:00:00",
    "price": 26.98
  },
  {
    "orderNo": 611,
    "vendor": "Costco Midlothian",
    "vendorOrderNo": 1222886710,
    "orderDate": "2025-09-08",
    "paymentMethod": 3005,
    "shippingMethod": "",
    "trackingNumber": "",
    "sku": 952912,
    "qty": 1,
    "received": "9/12/2025 0:00:00",
    "price": 32.99
  },
  {
    "orderNo": 617,
    "vendor": "Costco Midlothian",
    "vendorOrderNo": 1224682440,
    "orderDate": "2025-09-17",
    "paymentMethod": 3005,
    "shippingMethod": "",
    "trackingNumber": "",
    "sku": 210120,
    "qty": 1,
    "received": "9/22/2025 0:00:00",
    "price": 25.15
  },
  {
    "orderNo": 619,
    "vendor": "Costco Midlothian",
    "vendorOrderNo": "",
    "orderDate": "2025-09-19",
    "paymentMethod": 3005,
    "shippingMethod": "",
    "trackingNumber": "",
    "sku": 954930,
    "qty": 1,
    "received": "9/23/2025 0:00:00",
    "price": 19.58
  },
  {
    "orderNo": 640,
    "vendor": "Fresh Chili Company",
    "vendorOrderNo": "FCC-439711",
    "orderDate": "2025-11-05",
    "paymentMethod": 5933,
    "shippingMethod": "",
    "trackingNumber": "",
    "sku": 569163,
    "qty": 1,
    "received": "11/12/2025 0:00:00",
    "price": 10.94
  },
  {
    "orderNo": 643,
    "vendor": "Fresh Chili Company",
    "vendorOrderNo": "FCC-300949",
    "orderDate": "2024-10-28",
    "paymentMethod": 3005,
    "shippingMethod": "",
    "trackingNumber": "",
    "sku": 624543,
    "qty": 1,
    "received": "11/5/2024 0:00:00",
    "price": 0
  },
  {
    "orderNo": 658,
    "vendor": "Google Fi",
    "vendorOrderNo": "GS.3154-4383-9660",
    "orderDate": "2025-12-08",
    "paymentMethod": 5933,
    "shippingMethod": "fedex",
    "trackingNumber": 451684887450,
    "sku": "BSP7S3",
    "qty": 1,
    "received": "12/20/2025 0:00:00",
    "price": 49.99
  },
  {
    "orderNo": 566,
    "vendor": "Kroger, West Cary Street",
    "vendorOrderNo": "",
    "orderDate": "2025-07-20",
    "paymentMethod": 3005,
    "shippingMethod": "oldmanwalking",
    "trackingNumber": "",
    "sku": "000860",
    "qty": 1,
    "received": "7/20/2025 0:00:00",
    "price": 0.15
  },
  {
    "orderNo": 566,
    "vendor": "Kroger, West Cary Street",
    "vendorOrderNo": "",
    "orderDate": "2025-07-20",
    "paymentMethod": 3005,
    "shippingMethod": "oldmanwalking",
    "trackingNumber": "",
    "sku": "035357",
    "qty": 1,
    "received": "7/20/2025 0:00:00",
    "price": 3.28
  },
  {
    "orderNo": 566,
    "vendor": "Kroger, West Cary Street",
    "vendorOrderNo": "",
    "orderDate": "2025-07-20",
    "paymentMethod": 3005,
    "shippingMethod": "oldmanwalking",
    "trackingNumber": "",
    "sku": 702351,
    "qty": 1,
    "received": "7/20/2025 0:00:00",
    "price": 12.98
  },
  {
    "orderNo": 566,
    "vendor": "Kroger, West Cary Street",
    "vendorOrderNo": "",
    "orderDate": "2025-07-20",
    "paymentMethod": 3005,
    "shippingMethod": "oldmanwalking",
    "trackingNumber": "",
    "sku": 714332,
    "qty": 2,
    "received": "7/20/2025 0:00:00",
    "price": 3
  },
  {
    "orderNo": 567,
    "vendor": "Kroger, West Cary Street",
    "vendorOrderNo": "",
    "orderDate": "2025-07-21",
    "paymentMethod": 3005,
    "shippingMethod": "",
    "trackingNumber": "",
    "sku": "000028",
    "qty": 1,
    "received": "7/19/2025 0:00:00",
    "price": 4.98
  },
  {
    "orderNo": 567,
    "vendor": "Kroger, West Cary Street",
    "vendorOrderNo": "",
    "orderDate": "2025-07-21",
    "paymentMethod": 3005,
    "shippingMethod": "",
    "trackingNumber": "",
    "sku": "000860",
    "qty": 1,
    "received": "7/21/2025 0:00:00",
    "price": 0.15
  },
  {
    "orderNo": 567,
    "vendor": "Kroger, West Cary Street",
    "vendorOrderNo": "",
    "orderDate": "2025-07-21",
    "paymentMethod": 3005,
    "shippingMethod": "",
    "trackingNumber": "",
    "sku": "001615",
    "qty": 1,
    "received": "7/21/2025 0:00:00",
    "price": 2.76
  },
  {
    "orderNo": 567,
    "vendor": "Kroger, West Cary Street",
    "vendorOrderNo": "",
    "orderDate": "2025-07-21",
    "paymentMethod": 3005,
    "shippingMethod": "",
    "trackingNumber": "",
    "sku": "004011",
    "qty": 3.2,
    "received": "7/21/2025 0:00:00",
    "price": 1.76
  },
  {
    "orderNo": 567,
    "vendor": "Kroger, West Cary Street",
    "vendorOrderNo": "",
    "orderDate": "2025-07-21",
    "paymentMethod": 3005,
    "shippingMethod": "",
    "trackingNumber": "",
    "sku": "004068",
    "qty": 1,
    "received": "7/21/2025 0:00:00",
    "price": 0.99
  },
  {
    "orderNo": 567,
    "vendor": "Kroger, West Cary Street",
    "vendorOrderNo": "",
    "orderDate": "2025-07-21",
    "paymentMethod": 3005,
    "shippingMethod": "",
    "trackingNumber": "",
    "sku": "004090",
    "qty": 1,
    "received": "7/21/2025 0:00:00",
    "price": 1.71
  },
  {
    "orderNo": 567,
    "vendor": "Kroger, West Cary Street",
    "vendorOrderNo": "",
    "orderDate": "2025-07-21",
    "paymentMethod": 3005,
    "shippingMethod": "",
    "trackingNumber": "",
    "sku": "004664",
    "qty": 1.83,
    "received": "7/21/2025 0:00:00",
    "price": 4
  },
  {
    "orderNo": 567,
    "vendor": "Kroger, West Cary Street",
    "vendorOrderNo": "",
    "orderDate": "2025-07-21",
    "paymentMethod": 3005,
    "shippingMethod": "",
    "trackingNumber": "",
    "sku": "050054",
    "qty": 1,
    "received": "7/19/2025 0:00:00",
    "price": 4.48
  },
  {
    "orderNo": 567,
    "vendor": "Kroger, West Cary Street",
    "vendorOrderNo": "",
    "orderDate": "2025-07-21",
    "paymentMethod": 3005,
    "shippingMethod": "",
    "trackingNumber": "",
    "sku": "089301",
    "qty": 1,
    "received": "7/19/2025 0:00:00",
    "price": 4.28
  },
  {
    "orderNo": 567,
    "vendor": "Kroger, West Cary Street",
    "vendorOrderNo": "",
    "orderDate": "2025-07-21",
    "paymentMethod": 3005,
    "shippingMethod": "",
    "trackingNumber": "",
    "sku": "091487",
    "qty": 1,
    "received": "7/21/2025 0:00:00",
    "price": 2.35
  },
  {
    "orderNo": 567,
    "vendor": "Kroger, West Cary Street",
    "vendorOrderNo": "",
    "orderDate": "2025-07-21",
    "paymentMethod": 3005,
    "shippingMethod": "",
    "trackingNumber": "",
    "sku": 600232,
    "qty": 1,
    "received": "7/21/2025 0:00:00",
    "price": 4.28
  },
  {
    "orderNo": 567,
    "vendor": "Kroger, West Cary Street",
    "vendorOrderNo": "",
    "orderDate": "2025-07-21",
    "paymentMethod": 3005,
    "shippingMethod": "",
    "trackingNumber": "",
    "sku": 714690,
    "qty": 2,
    "received": "7/21/2025 0:00:00",
    "price": 3
  },
  {
    "orderNo": 567,
    "vendor": "Kroger, West Cary Street",
    "vendorOrderNo": "",
    "orderDate": "2025-07-21",
    "paymentMethod": 3005,
    "shippingMethod": "",
    "trackingNumber": "",
    "sku": 898760,
    "qty": 1,
    "received": "7/21/2025 0:00:00",
    "price": 2.39
  },
  {
    "orderNo": 576,
    "vendor": "Kroger, West Cary Street",
    "vendorOrderNo": "",
    "orderDate": "2025-08-14",
    "paymentMethod": 3005,
    "shippingMethod": "",
    "trackingNumber": "",
    "sku": "000860",
    "qty": 1,
    "received": "8/11/2025 0:00:00",
    "price": 0.44
  },
  {
    "orderNo": 576,
    "vendor": "Kroger, West Cary Street",
    "vendorOrderNo": "",
    "orderDate": "2025-08-14",
    "paymentMethod": 3005,
    "shippingMethod": "",
    "trackingNumber": "",
    "sku": "001052",
    "qty": 1,
    "received": "8/11/2025 0:00:00",
    "price": 4.98
  },
  {
    "orderNo": 576,
    "vendor": "Kroger, West Cary Street",
    "vendorOrderNo": "",
    "orderDate": "2025-08-14",
    "paymentMethod": 3005,
    "shippingMethod": "",
    "trackingNumber": "",
    "sku": "004093",
    "qty": 1,
    "received": "8/11/2025 0:00:00",
    "price": 2.63
  },
  {
    "orderNo": 576,
    "vendor": "Kroger, West Cary Street",
    "vendorOrderNo": "",
    "orderDate": "2025-08-14",
    "paymentMethod": 3005,
    "shippingMethod": "",
    "trackingNumber": "",
    "sku": "004693",
    "qty": 1,
    "received": "8/11/2025 0:00:00",
    "price": 0.52
  },
  {
    "orderNo": 576,
    "vendor": "Kroger, West Cary Street",
    "vendorOrderNo": "",
    "orderDate": "2025-08-14",
    "paymentMethod": 3005,
    "shippingMethod": "",
    "trackingNumber": "",
    "sku": "011975",
    "qty": 1,
    "received": "8/11/2025 0:00:00",
    "price": 1
  },
  {
    "orderNo": 576,
    "vendor": "Kroger, West Cary Street",
    "vendorOrderNo": "",
    "orderDate": "2025-08-14",
    "paymentMethod": 3005,
    "shippingMethod": "",
    "trackingNumber": "",
    "sku": "038815",
    "qty": 1,
    "received": "8/11/2025 0:00:00",
    "price": 1.28
  },
  {
    "orderNo": 576,
    "vendor": "Kroger, West Cary Street",
    "vendorOrderNo": "",
    "orderDate": "2025-08-14",
    "paymentMethod": 3005,
    "shippingMethod": "",
    "trackingNumber": "",
    "sku": "050312",
    "qty": 1,
    "received": "8/11/2025 0:00:00",
    "price": 5.98
  },
  {
    "orderNo": 576,
    "vendor": "Kroger, West Cary Street",
    "vendorOrderNo": "",
    "orderDate": "2025-08-14",
    "paymentMethod": 3005,
    "shippingMethod": "",
    "trackingNumber": "",
    "sku": "060933",
    "qty": 1,
    "received": "8/11/2025 0:00:00",
    "price": 4.78
  },
  {
    "orderNo": 576,
    "vendor": "Kroger, West Cary Street",
    "vendorOrderNo": "",
    "orderDate": "2025-08-14",
    "paymentMethod": 3005,
    "shippingMethod": "",
    "trackingNumber": "",
    "sku": "080987",
    "qty": 1,
    "received": "8/11/2025 0:00:00",
    "price": 1.38
  },
  {
    "orderNo": 576,
    "vendor": "Kroger, West Cary Street",
    "vendorOrderNo": "",
    "orderDate": "2025-08-14",
    "paymentMethod": 3005,
    "shippingMethod": "",
    "trackingNumber": "",
    "sku": "084948",
    "qty": 1,
    "received": "8/11/2025 0:00:00",
    "price": 3.28
  },
  {
    "orderNo": 576,
    "vendor": "Kroger, West Cary Street",
    "vendorOrderNo": "",
    "orderDate": "2025-08-14",
    "paymentMethod": 3005,
    "shippingMethod": "",
    "trackingNumber": "",
    "sku": "091487",
    "qty": 1,
    "received": "8/11/2025 0:00:00",
    "price": 2.28
  },
  {
    "orderNo": 576,
    "vendor": "Kroger, West Cary Street",
    "vendorOrderNo": "",
    "orderDate": "2025-08-14",
    "paymentMethod": 3005,
    "shippingMethod": "",
    "trackingNumber": "",
    "sku": 214454,
    "qty": 1,
    "received": "8/11/2025 0:00:00",
    "price": 3.49
  },
  {
    "orderNo": 576,
    "vendor": "Kroger, West Cary Street",
    "vendorOrderNo": "",
    "orderDate": "2025-08-14",
    "paymentMethod": 3005,
    "shippingMethod": "",
    "trackingNumber": "",
    "sku": 600232,
    "qty": 1,
    "received": "8/11/2025 0:00:00",
    "price": 4.59
  },
  {
    "orderNo": 576,
    "vendor": "Kroger, West Cary Street",
    "vendorOrderNo": "",
    "orderDate": "2025-08-14",
    "paymentMethod": 3005,
    "shippingMethod": "",
    "trackingNumber": "",
    "sku": 950000,
    "qty": 1,
    "received": "8/11/2025 0:00:00",
    "price": 8.14
  },
  {
    "orderNo": 628,
    "vendor": "Kroger, West Cary Street",
    "vendorOrderNo": "",
    "orderDate": "2025-10-14",
    "paymentMethod": 5933,
    "shippingMethod": "",
    "trackingNumber": "",
    "sku": "004011",
    "qty": 2.7,
    "received": "10/16/2025 0:00:00",
    "price": 1.42
  },
  {
    "orderNo": 628,
    "vendor": "Kroger, West Cary Street",
    "vendorOrderNo": "",
    "orderDate": "2025-10-14",
    "paymentMethod": 5933,
    "shippingMethod": "",
    "trackingNumber": "",
    "sku": "010621",
    "qty": 1,
    "received": "10/16/2025 0:00:00",
    "price": 2.5
  },
  {
    "orderNo": 628,
    "vendor": "Kroger, West Cary Street",
    "vendorOrderNo": "",
    "orderDate": "2025-10-14",
    "paymentMethod": 5933,
    "shippingMethod": "",
    "trackingNumber": "",
    "sku": "050312",
    "qty": 1,
    "received": "10/16/2025 0:00:00",
    "price": 5.98
  },
  {
    "orderNo": 628,
    "vendor": "Kroger, West Cary Street",
    "vendorOrderNo": "",
    "orderDate": "2025-10-14",
    "paymentMethod": 5933,
    "shippingMethod": "",
    "trackingNumber": "",
    "sku": "060933",
    "qty": 1,
    "received": "10/16/2025 0:00:00",
    "price": 3.69
  },
  {
    "orderNo": 628,
    "vendor": "Kroger, West Cary Street",
    "vendorOrderNo": "",
    "orderDate": "2025-10-14",
    "paymentMethod": 5933,
    "shippingMethod": "",
    "trackingNumber": "",
    "sku": 213505,
    "qty": 1,
    "received": "10/16/2025 0:00:00",
    "price": 2.69
  },
  {
    "orderNo": 630,
    "vendor": "Kroger, West Cary Street",
    "vendorOrderNo": "",
    "orderDate": "2025-10-19",
    "paymentMethod": 5933,
    "shippingMethod": "",
    "trackingNumber": "",
    "sku": "002218",
    "qty": 1,
    "received": "10/19/2025 0:00:00",
    "price": 4.48
  },
  {
    "orderNo": 630,
    "vendor": "Kroger, West Cary Street",
    "vendorOrderNo": "",
    "orderDate": "2025-10-19",
    "paymentMethod": 5933,
    "shippingMethod": "",
    "trackingNumber": "",
    "sku": "004011",
    "qty": 2.7,
    "received": "10/19/2025 0:00:00",
    "price": 1.85
  },
  {
    "orderNo": 630,
    "vendor": "Kroger, West Cary Street",
    "vendorOrderNo": "",
    "orderDate": "2025-10-19",
    "paymentMethod": 5933,
    "shippingMethod": "",
    "trackingNumber": "",
    "sku": "007456",
    "qty": 1,
    "received": "10/19/2025 0:00:00",
    "price": 7.44
  },
  {
    "orderNo": 630,
    "vendor": "Kroger, West Cary Street",
    "vendorOrderNo": "",
    "orderDate": "2025-10-19",
    "paymentMethod": 5933,
    "shippingMethod": "",
    "trackingNumber": "",
    "sku": "017201",
    "qty": 1,
    "received": "10/19/2025 0:00:00",
    "price": 6.98
  },
  {
    "orderNo": 630,
    "vendor": "Kroger, West Cary Street",
    "vendorOrderNo": "",
    "orderDate": "2025-10-19",
    "paymentMethod": 5933,
    "shippingMethod": "",
    "trackingNumber": "",
    "sku": "050312",
    "qty": 1,
    "received": "10/19/2025 0:00:00",
    "price": 5.98
  },
  {
    "orderNo": 630,
    "vendor": "Kroger, West Cary Street",
    "vendorOrderNo": "",
    "orderDate": "2025-10-19",
    "paymentMethod": 5933,
    "shippingMethod": "",
    "trackingNumber": "",
    "sku": "060933",
    "qty": 1,
    "received": "10/19/2025 0:00:00",
    "price": 3.69
  },
  {
    "orderNo": 630,
    "vendor": "Kroger, West Cary Street",
    "vendorOrderNo": "",
    "orderDate": "2025-10-19",
    "paymentMethod": 5933,
    "shippingMethod": "",
    "trackingNumber": "",
    "sku": 111252,
    "qty": 1,
    "received": "10/19/2025 0:00:00",
    "price": 3.18
  },
  {
    "orderNo": 636,
    "vendor": "Kroger, West Cary Street",
    "vendorOrderNo": "",
    "orderDate": "2025-11-02",
    "paymentMethod": 5933,
    "shippingMethod": "",
    "trackingNumber": "",
    "sku": "002256",
    "qty": 1,
    "received": "11/3/2025 0:00:00",
    "price": 21.98
  },
  {
    "orderNo": 636,
    "vendor": "Kroger, West Cary Street",
    "vendorOrderNo": "",
    "orderDate": "2025-11-02",
    "paymentMethod": 5933,
    "shippingMethod": "",
    "trackingNumber": "",
    "sku": "010098",
    "qty": 1,
    "received": "11/3/2025 0:00:00",
    "price": 3.99
  },
  {
    "orderNo": 636,
    "vendor": "Kroger, West Cary Street",
    "vendorOrderNo": "",
    "orderDate": "2025-11-02",
    "paymentMethod": 5933,
    "shippingMethod": "",
    "trackingNumber": "",
    "sku": "050312",
    "qty": 1,
    "received": "11/3/2025 0:00:00",
    "price": 5.98
  },
  {
    "orderNo": 636,
    "vendor": "Kroger, West Cary Street",
    "vendorOrderNo": "",
    "orderDate": "2025-11-02",
    "paymentMethod": 5933,
    "shippingMethod": "",
    "trackingNumber": "",
    "sku": 200276,
    "qty": 1,
    "received": "11/3/2025 0:00:00",
    "price": 5.48
  },
  {
    "orderNo": 636,
    "vendor": "Kroger, West Cary Street",
    "vendorOrderNo": "",
    "orderDate": "2025-11-02",
    "paymentMethod": 5933,
    "shippingMethod": "",
    "trackingNumber": "",
    "sku": 309216,
    "qty": 1,
    "received": "11/3/2025 0:00:00",
    "price": 5
  },
  {
    "orderNo": 636,
    "vendor": "Kroger, West Cary Street",
    "vendorOrderNo": "",
    "orderDate": "2025-11-02",
    "paymentMethod": 5933,
    "shippingMethod": "",
    "trackingNumber": "",
    "sku": 795410,
    "qty": 1,
    "received": "11/3/2025 0:00:00",
    "price": 3.99
  },
  {
    "orderNo": 642,
    "vendor": "Kroger, West Cary Street",
    "vendorOrderNo": "",
    "orderDate": "2025-11-12",
    "paymentMethod": 5933,
    "shippingMethod": "",
    "trackingNumber": "",
    "sku": "001700",
    "qty": 1,
    "received": "11/12/2025 0:00:00",
    "price": 4.28
  },
  {
    "orderNo": 642,
    "vendor": "Kroger, West Cary Street",
    "vendorOrderNo": "",
    "orderDate": "2025-11-12",
    "paymentMethod": 5933,
    "shippingMethod": "",
    "trackingNumber": "",
    "sku": "004068",
    "qty": 0.87,
    "received": "11/12/2025 0:00:00",
    "price": 1.09
  },
  {
    "orderNo": 642,
    "vendor": "Kroger, West Cary Street",
    "vendorOrderNo": "",
    "orderDate": "2025-11-12",
    "paymentMethod": 5933,
    "shippingMethod": "",
    "trackingNumber": "",
    "sku": "004093",
    "qty": 1.12,
    "received": "11/12/2025 0:00:00",
    "price": 1.71
  },
  {
    "orderNo": 642,
    "vendor": "Kroger, West Cary Street",
    "vendorOrderNo": "",
    "orderDate": "2025-11-12",
    "paymentMethod": 5933,
    "shippingMethod": "",
    "trackingNumber": "",
    "sku": "004664",
    "qty": 1.81,
    "received": "11/12/2025 0:00:00",
    "price": 4.07
  },
  {
    "orderNo": 642,
    "vendor": "Kroger, West Cary Street",
    "vendorOrderNo": "",
    "orderDate": "2025-11-12",
    "paymentMethod": 5933,
    "shippingMethod": "",
    "trackingNumber": "",
    "sku": "004705",
    "qty": 0.58,
    "received": "11/12/2025 0:00:00",
    "price": 1.08
  },
  {
    "orderNo": 642,
    "vendor": "Kroger, West Cary Street",
    "vendorOrderNo": "",
    "orderDate": "2025-11-12",
    "paymentMethod": 5933,
    "shippingMethod": "",
    "trackingNumber": "",
    "sku": "005158",
    "qty": 1,
    "received": "11/12/2025 0:00:00",
    "price": 2.99
  },
  {
    "orderNo": 642,
    "vendor": "Kroger, West Cary Street",
    "vendorOrderNo": "",
    "orderDate": "2025-11-12",
    "paymentMethod": 5933,
    "shippingMethod": "",
    "trackingNumber": "",
    "sku": "007062",
    "qty": 1,
    "received": "11/12/2025 0:00:00",
    "price": 5.17
  },
  {
    "orderNo": 642,
    "vendor": "Kroger, West Cary Street",
    "vendorOrderNo": "",
    "orderDate": "2025-11-12",
    "paymentMethod": 5933,
    "shippingMethod": "",
    "trackingNumber": "",
    "sku": "010098",
    "qty": 1,
    "received": "11/12/2025 0:00:00",
    "price": 4.28
  },
  {
    "orderNo": 642,
    "vendor": "Kroger, West Cary Street",
    "vendorOrderNo": "",
    "orderDate": "2025-11-12",
    "paymentMethod": 5933,
    "shippingMethod": "",
    "trackingNumber": "",
    "sku": "040601",
    "qty": 1,
    "received": "11/12/2025 0:00:00",
    "price": 1.78
  },
  {
    "orderNo": 642,
    "vendor": "Kroger, West Cary Street",
    "vendorOrderNo": "",
    "orderDate": "2025-11-12",
    "paymentMethod": 5933,
    "shippingMethod": "",
    "trackingNumber": "",
    "sku": "050312",
    "qty": 2,
    "received": "11/12/2025 0:00:00",
    "price": 11.97
  },
  {
    "orderNo": 642,
    "vendor": "Kroger, West Cary Street",
    "vendorOrderNo": "",
    "orderDate": "2025-11-12",
    "paymentMethod": 5933,
    "shippingMethod": "",
    "trackingNumber": "",
    "sku": "060914",
    "qty": 1,
    "received": "11/12/2025 0:00:00",
    "price": 9.89
  },
  {
    "orderNo": 642,
    "vendor": "Kroger, West Cary Street",
    "vendorOrderNo": "",
    "orderDate": "2025-11-12",
    "paymentMethod": 5933,
    "shippingMethod": "",
    "trackingNumber": "",
    "sku": "067617",
    "qty": 1,
    "received": "11/12/2025 0:00:00",
    "price": 2.49
  },
  {
    "orderNo": 642,
    "vendor": "Kroger, West Cary Street",
    "vendorOrderNo": "",
    "orderDate": "2025-11-12",
    "paymentMethod": 5933,
    "shippingMethod": "",
    "trackingNumber": "",
    "sku": "089301",
    "qty": 1,
    "received": "11/12/2025 0:00:00",
    "price": 3.99
  },
  {
    "orderNo": 642,
    "vendor": "Kroger, West Cary Street",
    "vendorOrderNo": "",
    "orderDate": "2025-11-12",
    "paymentMethod": 5933,
    "shippingMethod": "",
    "trackingNumber": "",
    "sku": 200276,
    "qty": 1,
    "received": "11/12/2025 0:00:00",
    "price": 5.48
  },
  {
    "orderNo": 646,
    "vendor": "Kroger, West Cary Street",
    "vendorOrderNo": "",
    "orderDate": "2025-11-26",
    "paymentMethod": "SNAP 0834",
    "shippingMethod": "",
    "trackingNumber": "",
    "sku": "001117",
    "qty": 1,
    "received": "11/24/2025 0:00:00",
    "price": 3.58
  },
  {
    "orderNo": 646,
    "vendor": "Kroger, West Cary Street",
    "vendorOrderNo": "",
    "orderDate": "2025-11-26",
    "paymentMethod": "SNAP 0834",
    "shippingMethod": "",
    "trackingNumber": "",
    "sku": "004011",
    "qty": 2.59,
    "received": "11/24/2025 0:00:00",
    "price": 1.21
  },
  {
    "orderNo": 646,
    "vendor": "Kroger, West Cary Street",
    "vendorOrderNo": "",
    "orderDate": "2025-11-26",
    "paymentMethod": "SNAP 0834",
    "shippingMethod": "",
    "trackingNumber": "",
    "sku": "004504",
    "qty": 1,
    "received": "11/24/2025 0:00:00",
    "price": 1.99
  },
  {
    "orderNo": 646,
    "vendor": "Kroger, West Cary Street",
    "vendorOrderNo": "",
    "orderDate": "2025-11-26",
    "paymentMethod": "SNAP 0834",
    "shippingMethod": "",
    "trackingNumber": "",
    "sku": "005158",
    "qty": 1,
    "received": "11/24/2025 0:00:00",
    "price": 3.58
  },
  {
    "orderNo": 646,
    "vendor": "Kroger, West Cary Street",
    "vendorOrderNo": "",
    "orderDate": "2025-11-26",
    "paymentMethod": "SNAP 0834",
    "shippingMethod": "",
    "trackingNumber": "",
    "sku": "040601",
    "qty": 1,
    "received": "11/24/2025 0:00:00",
    "price": 1.78
  },
  {
    "orderNo": 646,
    "vendor": "Kroger, West Cary Street",
    "vendorOrderNo": "",
    "orderDate": "2025-11-26",
    "paymentMethod": "SNAP 0834",
    "shippingMethod": "",
    "trackingNumber": "",
    "sku": "050312",
    "qty": 1,
    "received": "11/24/2025 0:00:00",
    "price": 5.98
  },
  {
    "orderNo": 646,
    "vendor": "Kroger, West Cary Street",
    "vendorOrderNo": "",
    "orderDate": "2025-11-26",
    "paymentMethod": "SNAP 0834",
    "shippingMethod": "",
    "trackingNumber": "",
    "sku": "091487",
    "qty": 1,
    "received": "11/24/2025 0:00:00",
    "price": 2.28
  },
  {
    "orderNo": 649,
    "vendor": "Kroger, West Cary Street",
    "vendorOrderNo": "",
    "orderDate": "2025-11-28",
    "paymentMethod": 5933,
    "shippingMethod": "oldmanwalking",
    "trackingNumber": "",
    "sku": "002818",
    "qty": 1,
    "received": "11/28/2025 0:00:00",
    "price": 7.98
  },
  {
    "orderNo": 649,
    "vendor": "Kroger, West Cary Street",
    "vendorOrderNo": "",
    "orderDate": "2025-11-28",
    "paymentMethod": 5933,
    "shippingMethod": "oldmanwalking",
    "trackingNumber": "",
    "sku": "004068",
    "qty": 0.98,
    "received": "",
    "price": 0
  },
  {
    "orderNo": 649,
    "vendor": "Kroger, West Cary Street",
    "vendorOrderNo": "",
    "orderDate": "2025-11-28",
    "paymentMethod": 5933,
    "shippingMethod": "oldmanwalking",
    "trackingNumber": "",
    "sku": "004664",
    "qty": 1.96,
    "received": "11/28/2025 0:00:00",
    "price": 3.66
  },
  {
    "orderNo": 649,
    "vendor": "Kroger, West Cary Street",
    "vendorOrderNo": "",
    "orderDate": "2025-11-28",
    "paymentMethod": 5933,
    "shippingMethod": "oldmanwalking",
    "trackingNumber": "",
    "sku": "007062",
    "qty": 1.5,
    "received": "11/28/2025 0:00:00",
    "price": 2.58
  },
  {
    "orderNo": 649,
    "vendor": "Kroger, West Cary Street",
    "vendorOrderNo": "",
    "orderDate": "2025-11-28",
    "paymentMethod": 5933,
    "shippingMethod": "oldmanwalking",
    "trackingNumber": "",
    "sku": "010098",
    "qty": 1,
    "received": "11/28/2025 0:00:00",
    "price": 4.28
  },
  {
    "orderNo": 649,
    "vendor": "Kroger, West Cary Street",
    "vendorOrderNo": "",
    "orderDate": "2025-11-28",
    "paymentMethod": 5933,
    "shippingMethod": "oldmanwalking",
    "trackingNumber": "",
    "sku": "015121",
    "qty": 1,
    "received": "",
    "price": 0
  },
  {
    "orderNo": 649,
    "vendor": "Kroger, West Cary Street",
    "vendorOrderNo": "",
    "orderDate": "2025-11-28",
    "paymentMethod": 5933,
    "shippingMethod": "oldmanwalking",
    "trackingNumber": "",
    "sku": "017201",
    "qty": 1,
    "received": "11/28/2025 0:00:00",
    "price": 6.98
  },
  {
    "orderNo": 649,
    "vendor": "Kroger, West Cary Street",
    "vendorOrderNo": "",
    "orderDate": "2025-11-28",
    "paymentMethod": 5933,
    "shippingMethod": "oldmanwalking",
    "trackingNumber": "",
    "sku": "040601",
    "qty": 1,
    "received": "11/28/2025 0:00:00",
    "price": 1.88
  },
  {
    "orderNo": 649,
    "vendor": "Kroger, West Cary Street",
    "vendorOrderNo": "",
    "orderDate": "2025-11-28",
    "paymentMethod": 5933,
    "shippingMethod": "oldmanwalking",
    "trackingNumber": "",
    "sku": "050312",
    "qty": 1,
    "received": "11/28/2025 0:00:00",
    "price": 5.98
  },
  {
    "orderNo": 649,
    "vendor": "Kroger, West Cary Street",
    "vendorOrderNo": "",
    "orderDate": "2025-11-28",
    "paymentMethod": 5933,
    "shippingMethod": "oldmanwalking",
    "trackingNumber": "",
    "sku": "086694",
    "qty": 1,
    "received": "11/28/2025 0:00:00",
    "price": 1.78
  },
  {
    "orderNo": 649,
    "vendor": "Kroger, West Cary Street",
    "vendorOrderNo": "",
    "orderDate": "2025-11-28",
    "paymentMethod": 5933,
    "shippingMethod": "oldmanwalking",
    "trackingNumber": "",
    "sku": 111252,
    "qty": 1,
    "received": "11/28/2025 0:00:00",
    "price": 1.59
  },
  {
    "orderNo": 649,
    "vendor": "Kroger, West Cary Street",
    "vendorOrderNo": "",
    "orderDate": "2025-11-28",
    "paymentMethod": 5933,
    "shippingMethod": "oldmanwalking",
    "trackingNumber": "",
    "sku": 200276,
    "qty": 1,
    "received": "11/28/2025 0:00:00",
    "price": 5.48
  },
  {
    "orderNo": 649,
    "vendor": "Kroger, West Cary Street",
    "vendorOrderNo": "",
    "orderDate": "2025-11-28",
    "paymentMethod": 5933,
    "shippingMethod": "oldmanwalking",
    "trackingNumber": "",
    "sku": 213505,
    "qty": 1,
    "received": "11/28/2025 0:00:00",
    "price": 2.69
  },
  {
    "orderNo": 649,
    "vendor": "Kroger, West Cary Street",
    "vendorOrderNo": "",
    "orderDate": "2025-11-28",
    "paymentMethod": 5933,
    "shippingMethod": "oldmanwalking",
    "trackingNumber": "",
    "sku": 850218,
    "qty": 1,
    "received": "11/28/2025 0:00:00",
    "price": 1.25
  },
  {
    "orderNo": 649,
    "vendor": "Kroger, West Cary Street",
    "vendorOrderNo": "",
    "orderDate": "2025-11-28",
    "paymentMethod": 5933,
    "shippingMethod": "oldmanwalking",
    "trackingNumber": "",
    "sku": 876607,
    "qty": 1,
    "received": "11/28/2025 0:00:00",
    "price": 1.78
  },
  {
    "orderNo": 652,
    "vendor": "Kroger, West Cary Street",
    "vendorOrderNo": "",
    "orderDate": "2025-12-04",
    "paymentMethod": "SNAP 0834",
    "shippingMethod": "oldmanwalking",
    "trackingNumber": "",
    "sku": "004011",
    "qty": 2.59,
    "received": "12/4/2025 0:00:00",
    "price": 1.44
  },
  {
    "orderNo": 652,
    "vendor": "Kroger, West Cary Street",
    "vendorOrderNo": "",
    "orderDate": "2025-12-04",
    "paymentMethod": "SNAP 0834",
    "shippingMethod": "oldmanwalking",
    "trackingNumber": "",
    "sku": "004068",
    "qty": 1,
    "received": "12/4/2025 0:00:00",
    "price": 1.05
  },
  {
    "orderNo": 652,
    "vendor": "Kroger, West Cary Street",
    "vendorOrderNo": "",
    "orderDate": "2025-12-04",
    "paymentMethod": "SNAP 0834",
    "shippingMethod": "oldmanwalking",
    "trackingNumber": "",
    "sku": "015121",
    "qty": 1,
    "received": "12/4/2025 0:00:00",
    "price": 6.98
  },
  {
    "orderNo": 652,
    "vendor": "Kroger, West Cary Street",
    "vendorOrderNo": "",
    "orderDate": "2025-12-04",
    "paymentMethod": "SNAP 0834",
    "shippingMethod": "oldmanwalking",
    "trackingNumber": "",
    "sku": "050312",
    "qty": 1,
    "received": "12/4/2025 0:00:00",
    "price": 5.98
  },
  {
    "orderNo": 652,
    "vendor": "Kroger, West Cary Street",
    "vendorOrderNo": "",
    "orderDate": "2025-12-04",
    "paymentMethod": "SNAP 0834",
    "shippingMethod": "oldmanwalking",
    "trackingNumber": "",
    "sku": "060933",
    "qty": 1,
    "received": "12/4/2025 0:00:00",
    "price": 2.98
  },
  {
    "orderNo": 659,
    "vendor": "Kroger, West Cary Street",
    "vendorOrderNo": "",
    "orderDate": "2025-12-10",
    "paymentMethod": 5933,
    "shippingMethod": "oldmanwalking",
    "trackingNumber": "",
    "sku": "004011",
    "qty": 2.59,
    "received": "12/11/2025 0:00:00",
    "price": 1.5
  },
  {
    "orderNo": 659,
    "vendor": "Kroger, West Cary Street",
    "vendorOrderNo": "",
    "orderDate": "2025-12-10",
    "paymentMethod": 5933,
    "shippingMethod": "oldmanwalking",
    "trackingNumber": "",
    "sku": "004705",
    "qty": 0.44,
    "received": "12/11/2025 0:00:00",
    "price": 1.64
  },
  {
    "orderNo": 659,
    "vendor": "Kroger, West Cary Street",
    "vendorOrderNo": "",
    "orderDate": "2025-12-10",
    "paymentMethod": 5933,
    "shippingMethod": "oldmanwalking",
    "trackingNumber": "",
    "sku": "038488",
    "qty": 1,
    "received": "12/11/2025 0:00:00",
    "price": 3
  },
  {
    "orderNo": 659,
    "vendor": "Kroger, West Cary Street",
    "vendorOrderNo": "",
    "orderDate": "2025-12-10",
    "paymentMethod": 5933,
    "shippingMethod": "oldmanwalking",
    "trackingNumber": "",
    "sku": "050312",
    "qty": 1,
    "received": "12/11/2025 0:00:00",
    "price": 5.98
  },
  {
    "orderNo": 659,
    "vendor": "Kroger, West Cary Street",
    "vendorOrderNo": "",
    "orderDate": "2025-12-10",
    "paymentMethod": 5933,
    "shippingMethod": "oldmanwalking",
    "trackingNumber": "",
    "sku": 460707,
    "qty": 1,
    "received": "12/11/2025 0:00:00",
    "price": 1.99
  },
  {
    "orderNo": 615,
    "vendor": "Kroger, Laburnum",
    "vendorOrderNo": "",
    "orderDate": "2025-09-14",
    "paymentMethod": 3005,
    "shippingMethod": "",
    "trackingNumber": "",
    "sku": "000708",
    "qty": 1,
    "received": "9/15/2025 0:00:00",
    "price": 5.81
  },
  {
    "orderNo": 615,
    "vendor": "Kroger, Laburnum",
    "vendorOrderNo": "",
    "orderDate": "2025-09-14",
    "paymentMethod": 3005,
    "shippingMethod": "",
    "trackingNumber": "",
    "sku": "000860",
    "qty": 1,
    "received": "9/15/2025 0:00:00",
    "price": 0.4
  },
  {
    "orderNo": 615,
    "vendor": "Kroger, Laburnum",
    "vendorOrderNo": "",
    "orderDate": "2025-09-14",
    "paymentMethod": 3005,
    "shippingMethod": "",
    "trackingNumber": "",
    "sku": "050312",
    "qty": 1,
    "received": "9/15/2025 0:00:00",
    "price": 5.98
  },
  {
    "orderNo": 615,
    "vendor": "Kroger, Laburnum",
    "vendorOrderNo": "",
    "orderDate": "2025-09-14",
    "paymentMethod": 3005,
    "shippingMethod": "",
    "trackingNumber": "",
    "sku": "060933",
    "qty": 1,
    "received": "9/15/2025 0:00:00",
    "price": 4.51
  },
  {
    "orderNo": 615,
    "vendor": "Kroger, Laburnum",
    "vendorOrderNo": "",
    "orderDate": "2025-09-14",
    "paymentMethod": 3005,
    "shippingMethod": "",
    "trackingNumber": "",
    "sku": 715267,
    "qty": 1,
    "received": "9/15/2025 0:00:00",
    "price": 0.87
  },
  {
    "orderNo": 645,
    "vendor": "Kroger, Laburnum",
    "vendorOrderNo": "",
    "orderDate": "2025-11-17",
    "paymentMethod": "SNAP 0834",
    "shippingMethod": "",
    "trackingNumber": "",
    "sku": "004068",
    "qty": 1,
    "received": "11/19/2025 0:00:00",
    "price": 2.18
  },
  {
    "orderNo": 645,
    "vendor": "Kroger, Laburnum",
    "vendorOrderNo": "",
    "orderDate": "2025-11-17",
    "paymentMethod": "SNAP 0834",
    "shippingMethod": "",
    "trackingNumber": "",
    "sku": "004664",
    "qty": 1.96,
    "received": "11/19/2025 0:00:00",
    "price": 4.99
  },
  {
    "orderNo": 645,
    "vendor": "Kroger, Laburnum",
    "vendorOrderNo": "",
    "orderDate": "2025-11-17",
    "paymentMethod": "SNAP 0834",
    "shippingMethod": "",
    "trackingNumber": "",
    "sku": "010381",
    "qty": 1,
    "received": "11/19/2025 0:00:00",
    "price": 3.48
  },
  {
    "orderNo": 645,
    "vendor": "Kroger, Laburnum",
    "vendorOrderNo": "",
    "orderDate": "2025-11-17",
    "paymentMethod": "SNAP 0834",
    "shippingMethod": "",
    "trackingNumber": "",
    "sku": "039316",
    "qty": 1,
    "received": "11/19/2025 0:00:00",
    "price": 3.98
  },
  {
    "orderNo": 645,
    "vendor": "Kroger, Laburnum",
    "vendorOrderNo": "",
    "orderDate": "2025-11-17",
    "paymentMethod": "SNAP 0834",
    "shippingMethod": "",
    "trackingNumber": "",
    "sku": "040601",
    "qty": 1,
    "received": "11/19/2025 0:00:00",
    "price": 1.78
  },
  {
    "orderNo": 645,
    "vendor": "Kroger, Laburnum",
    "vendorOrderNo": "",
    "orderDate": "2025-11-17",
    "paymentMethod": "SNAP 0834",
    "shippingMethod": "",
    "trackingNumber": "",
    "sku": "060933",
    "qty": 1,
    "received": "11/19/2025 0:00:00",
    "price": 2.98
  },
  {
    "orderNo": 645,
    "vendor": "Kroger, Laburnum",
    "vendorOrderNo": "",
    "orderDate": "2025-11-17",
    "paymentMethod": "SNAP 0834",
    "shippingMethod": "",
    "trackingNumber": "",
    "sku": 152641,
    "qty": 1,
    "received": "11/19/2025 0:00:00",
    "price": 5.98
  },
  {
    "orderNo": 645,
    "vendor": "Kroger, Laburnum",
    "vendorOrderNo": "",
    "orderDate": "2025-11-17",
    "paymentMethod": "SNAP 0834",
    "shippingMethod": "",
    "trackingNumber": "",
    "sku": 650191,
    "qty": 1,
    "received": "11/19/2025 0:00:00",
    "price": 5.98
  },
  {
    "orderNo": 645,
    "vendor": "Kroger, Laburnum",
    "vendorOrderNo": "",
    "orderDate": "2025-11-17",
    "paymentMethod": "SNAP 0834",
    "shippingMethod": "",
    "trackingNumber": "",
    "sku": 972934,
    "qty": 1,
    "received": "11/19/2025 0:00:00",
    "price": 2.99
  },
  {
    "orderNo": 568,
    "vendor": "Kroger, Lombardi",
    "vendorOrderNo": "",
    "orderDate": "2025-08-09",
    "paymentMethod": 3005,
    "shippingMethod": "",
    "trackingNumber": "",
    "sku": "000860",
    "qty": 1,
    "received": "8/9/2025 0:00:00",
    "price": 0.52
  },
  {
    "orderNo": 568,
    "vendor": "Kroger, Lombardi",
    "vendorOrderNo": "",
    "orderDate": "2025-08-09",
    "paymentMethod": 3005,
    "shippingMethod": "",
    "trackingNumber": "",
    "sku": "003712",
    "qty": 1,
    "received": "8/9/2025 0:00:00",
    "price": 2.99
  },
  {
    "orderNo": 568,
    "vendor": "Kroger, Lombardi",
    "vendorOrderNo": "",
    "orderDate": "2025-08-09",
    "paymentMethod": 3005,
    "shippingMethod": "",
    "trackingNumber": "",
    "sku": "004011",
    "qty": 3.2,
    "received": "8/9/2025 0:00:00",
    "price": 1.3
  },
  {
    "orderNo": 568,
    "vendor": "Kroger, Lombardi",
    "vendorOrderNo": "",
    "orderDate": "2025-08-09",
    "paymentMethod": 3005,
    "shippingMethod": "",
    "trackingNumber": "",
    "sku": "004068",
    "qty": 1,
    "received": "8/9/2025 0:00:00",
    "price": 0.99
  },
  {
    "orderNo": 568,
    "vendor": "Kroger, Lombardi",
    "vendorOrderNo": "",
    "orderDate": "2025-08-09",
    "paymentMethod": 3005,
    "shippingMethod": "",
    "trackingNumber": "",
    "sku": "004090",
    "qty": 0.9,
    "received": "8/9/2025 0:00:00",
    "price": 1.97
  },
  {
    "orderNo": 568,
    "vendor": "Kroger, Lombardi",
    "vendorOrderNo": "",
    "orderDate": "2025-08-09",
    "paymentMethod": 3005,
    "shippingMethod": "",
    "trackingNumber": "",
    "sku": "004664",
    "qty": 1.8,
    "received": "8/9/2025 0:00:00",
    "price": 4.57
  },
  {
    "orderNo": 568,
    "vendor": "Kroger, Lombardi",
    "vendorOrderNo": "",
    "orderDate": "2025-08-09",
    "paymentMethod": 3005,
    "shippingMethod": "",
    "trackingNumber": "",
    "sku": "004705",
    "qty": 0.25,
    "received": "8/9/2025 0:00:00",
    "price": 1.64
  },
  {
    "orderNo": 568,
    "vendor": "Kroger, Lombardi",
    "vendorOrderNo": "",
    "orderDate": "2025-08-09",
    "paymentMethod": 3005,
    "shippingMethod": "",
    "trackingNumber": "",
    "sku": "017201",
    "qty": 1,
    "received": "8/9/2025 0:00:00",
    "price": 4.98
  },
  {
    "orderNo": 568,
    "vendor": "Kroger, Lombardi",
    "vendorOrderNo": "",
    "orderDate": "2025-08-09",
    "paymentMethod": 3005,
    "shippingMethod": "",
    "trackingNumber": "",
    "sku": "050312",
    "qty": 1,
    "received": "8/9/2025 0:00:00",
    "price": 5.98
  },
  {
    "orderNo": 568,
    "vendor": "Kroger, Lombardi",
    "vendorOrderNo": "",
    "orderDate": "2025-08-09",
    "paymentMethod": 3005,
    "shippingMethod": "",
    "trackingNumber": "",
    "sku": "060933",
    "qty": 2,
    "received": "8/9/2025 0:00:00",
    "price": 4.78
  },
  {
    "orderNo": 568,
    "vendor": "Kroger, Lombardi",
    "vendorOrderNo": "",
    "orderDate": "2025-08-09",
    "paymentMethod": 3005,
    "shippingMethod": "",
    "trackingNumber": "",
    "sku": "089301",
    "qty": 1,
    "received": "8/9/2025 0:00:00",
    "price": 4.28
  },
  {
    "orderNo": 568,
    "vendor": "Kroger, Lombardi",
    "vendorOrderNo": "",
    "orderDate": "2025-08-09",
    "paymentMethod": 3005,
    "shippingMethod": "",
    "trackingNumber": "",
    "sku": "091487",
    "qty": 1,
    "received": "8/9/2025 0:00:00",
    "price": 2.19
  },
  {
    "orderNo": 568,
    "vendor": "Kroger, Lombardi",
    "vendorOrderNo": "",
    "orderDate": "2025-08-09",
    "paymentMethod": 3005,
    "shippingMethod": "",
    "trackingNumber": "",
    "sku": 200276,
    "qty": 1,
    "received": "8/9/2025 0:00:00",
    "price": 5.48
  },
  {
    "orderNo": 568,
    "vendor": "Kroger, Lombardi",
    "vendorOrderNo": "",
    "orderDate": "2025-08-09",
    "paymentMethod": 3005,
    "shippingMethod": "",
    "trackingNumber": "",
    "sku": 500000,
    "qty": 1,
    "received": "8/9/2025 0:00:00",
    "price": 7.38
  },
  {
    "orderNo": 575,
    "vendor": "Kroger, Lombardi",
    "vendorOrderNo": "",
    "orderDate": "2025-08-04",
    "paymentMethod": "SNAP 0834",
    "shippingMethod": "",
    "trackingNumber": "",
    "sku": "001987",
    "qty": 1,
    "received": "8/4/2025 0:00:00",
    "price": 4.28
  },
  {
    "orderNo": 575,
    "vendor": "Kroger, Lombardi",
    "vendorOrderNo": "",
    "orderDate": "2025-08-04",
    "paymentMethod": "SNAP 0834",
    "shippingMethod": "",
    "trackingNumber": "",
    "sku": "050312",
    "qty": 1,
    "received": "8/4/2025 0:00:00",
    "price": 5.98
  },
  {
    "orderNo": 575,
    "vendor": "Kroger, Lombardi",
    "vendorOrderNo": "",
    "orderDate": "2025-08-04",
    "paymentMethod": "SNAP 0834",
    "shippingMethod": "",
    "trackingNumber": "",
    "sku": "060933",
    "qty": 1,
    "received": "8/4/2025 0:00:00",
    "price": 4.38
  },
  {
    "orderNo": 575,
    "vendor": "Kroger, Lombardi",
    "vendorOrderNo": "",
    "orderDate": "2025-08-04",
    "paymentMethod": "SNAP 0834",
    "shippingMethod": "",
    "trackingNumber": "",
    "sku": 200276,
    "qty": 1,
    "received": "8/4/2025 0:00:00",
    "price": 5.48
  },
  {
    "orderNo": 578,
    "vendor": "Kroger, Lombardi",
    "vendorOrderNo": "",
    "orderDate": "2025-08-12",
    "paymentMethod": 3005,
    "shippingMethod": "",
    "trackingNumber": "",
    "sku": "000860",
    "qty": 1,
    "received": "8/12/2025 0:00:00",
    "price": 0.15
  },
  {
    "orderNo": 578,
    "vendor": "Kroger, Lombardi",
    "vendorOrderNo": "",
    "orderDate": "2025-08-12",
    "paymentMethod": 3005,
    "shippingMethod": "",
    "trackingNumber": "",
    "sku": "010621",
    "qty": 1,
    "received": "8/12/2025 0:00:00",
    "price": 2.5
  },
  {
    "orderNo": 578,
    "vendor": "Kroger, Lombardi",
    "vendorOrderNo": "",
    "orderDate": "2025-08-12",
    "paymentMethod": 3005,
    "shippingMethod": "",
    "trackingNumber": "",
    "sku": 241939,
    "qty": 1,
    "received": "8/12/2025 0:00:00",
    "price": 3.39
  },
  {
    "orderNo": 579,
    "vendor": "Kroger, Lombardi",
    "vendorOrderNo": "",
    "orderDate": "2025-08-16",
    "paymentMethod": 3005,
    "shippingMethod": "",
    "trackingNumber": "",
    "sku": "000860",
    "qty": 1,
    "received": "8/16/2025 0:00:00",
    "price": 0.56
  },
  {
    "orderNo": 579,
    "vendor": "Kroger, Lombardi",
    "vendorOrderNo": "",
    "orderDate": "2025-08-16",
    "paymentMethod": 3005,
    "shippingMethod": "",
    "trackingNumber": "",
    "sku": "001618",
    "qty": 1,
    "received": "8/16/2025 0:00:00",
    "price": 1.78
  },
  {
    "orderNo": 579,
    "vendor": "Kroger, Lombardi",
    "vendorOrderNo": "",
    "orderDate": "2025-08-16",
    "paymentMethod": 3005,
    "shippingMethod": "",
    "trackingNumber": "",
    "sku": "004011",
    "qty": 2.8,
    "received": "8/16/2025 0:00:00",
    "price": 1.42
  },
  {
    "orderNo": 579,
    "vendor": "Kroger, Lombardi",
    "vendorOrderNo": "",
    "orderDate": "2025-08-16",
    "paymentMethod": 3005,
    "shippingMethod": "",
    "trackingNumber": "",
    "sku": "004068",
    "qty": 1,
    "received": "8/16/2025 0:00:00",
    "price": 0.99
  },
  {
    "orderNo": 579,
    "vendor": "Kroger, Lombardi",
    "vendorOrderNo": "",
    "orderDate": "2025-08-16",
    "paymentMethod": 3005,
    "shippingMethod": "",
    "trackingNumber": "",
    "sku": "004664",
    "qty": 2,
    "received": "8/16/2025 0:00:00",
    "price": 5.67
  },
  {
    "orderNo": 579,
    "vendor": "Kroger, Lombardi",
    "vendorOrderNo": "",
    "orderDate": "2025-08-16",
    "paymentMethod": 3005,
    "shippingMethod": "",
    "trackingNumber": "",
    "sku": "044150",
    "qty": 1,
    "received": "8/16/2025 0:00:00",
    "price": 9.98
  },
  {
    "orderNo": 579,
    "vendor": "Kroger, Lombardi",
    "vendorOrderNo": "",
    "orderDate": "2025-08-16",
    "paymentMethod": 3005,
    "shippingMethod": "",
    "trackingNumber": "",
    "sku": "060933",
    "qty": 1,
    "received": "8/16/2025 0:00:00",
    "price": 4.78
  },
  {
    "orderNo": 579,
    "vendor": "Kroger, Lombardi",
    "vendorOrderNo": "",
    "orderDate": "2025-08-16",
    "paymentMethod": 3005,
    "shippingMethod": "",
    "trackingNumber": "",
    "sku": "061689",
    "qty": 1,
    "received": "8/16/2025 0:00:00",
    "price": 5.98
  },
  {
    "orderNo": 579,
    "vendor": "Kroger, Lombardi",
    "vendorOrderNo": "",
    "orderDate": "2025-08-16",
    "paymentMethod": 3005,
    "shippingMethod": "",
    "trackingNumber": "",
    "sku": "067617",
    "qty": 1,
    "received": "8/16/2025 0:00:00",
    "price": 2.79
  },
  {
    "orderNo": 579,
    "vendor": "Kroger, Lombardi",
    "vendorOrderNo": "",
    "orderDate": "2025-08-16",
    "paymentMethod": 3005,
    "shippingMethod": "",
    "trackingNumber": "",
    "sku": "085021",
    "qty": 1,
    "received": "8/16/2025 0:00:00",
    "price": 1.25
  },
  {
    "orderNo": 579,
    "vendor": "Kroger, Lombardi",
    "vendorOrderNo": "",
    "orderDate": "2025-08-16",
    "paymentMethod": 3005,
    "shippingMethod": "",
    "trackingNumber": "",
    "sku": "089301",
    "qty": 1,
    "received": "8/16/2025 0:00:00",
    "price": 4.28
  },
  {
    "orderNo": 579,
    "vendor": "Kroger, Lombardi",
    "vendorOrderNo": "",
    "orderDate": "2025-08-16",
    "paymentMethod": 3005,
    "shippingMethod": "",
    "trackingNumber": "",
    "sku": "091487",
    "qty": 1,
    "received": "8/16/2025 0:00:00",
    "price": 2.28
  },
  {
    "orderNo": 579,
    "vendor": "Kroger, Lombardi",
    "vendorOrderNo": "",
    "orderDate": "2025-08-16",
    "paymentMethod": 3005,
    "shippingMethod": "",
    "trackingNumber": "",
    "sku": 177963,
    "qty": 1,
    "received": "8/16/2025 0:00:00",
    "price": 1.78
  },
  {
    "orderNo": 579,
    "vendor": "Kroger, Lombardi",
    "vendorOrderNo": "",
    "orderDate": "2025-08-16",
    "paymentMethod": 3005,
    "shippingMethod": "",
    "trackingNumber": "",
    "sku": 200276,
    "qty": 1,
    "received": "8/16/2025 0:00:00",
    "price": 5.48
  },
  {
    "orderNo": 579,
    "vendor": "Kroger, Lombardi",
    "vendorOrderNo": "",
    "orderDate": "2025-08-16",
    "paymentMethod": 3005,
    "shippingMethod": "",
    "trackingNumber": "",
    "sku": 502049,
    "qty": 1,
    "received": "8/16/2025 0:00:00",
    "price": 2.49
  },
  {
    "orderNo": 579,
    "vendor": "Kroger, Lombardi",
    "vendorOrderNo": "",
    "orderDate": "2025-08-16",
    "paymentMethod": 3005,
    "shippingMethod": "",
    "trackingNumber": "",
    "sku": 898760,
    "qty": 2,
    "received": "8/16/2025 0:00:00",
    "price": 4.78
  },
  {
    "orderNo": 584,
    "vendor": "Kroger, Lombardi",
    "vendorOrderNo": "",
    "orderDate": "2025-08-20",
    "paymentMethod": 3005,
    "shippingMethod": "",
    "trackingNumber": "",
    "sku": "000860",
    "qty": 1,
    "received": "8/20/2025 0:00:00",
    "price": 0.07
  },
  {
    "orderNo": 584,
    "vendor": "Kroger, Lombardi",
    "vendorOrderNo": "",
    "orderDate": "2025-08-20",
    "paymentMethod": 3005,
    "shippingMethod": "",
    "trackingNumber": "",
    "sku": 103232,
    "qty": 1,
    "received": "8/20/2025 0:00:00",
    "price": 1.78
  },
  {
    "orderNo": 584,
    "vendor": "Kroger, Lombardi",
    "vendorOrderNo": "",
    "orderDate": "2025-08-20",
    "paymentMethod": 3005,
    "shippingMethod": "",
    "trackingNumber": "",
    "sku": 213505,
    "qty": 1,
    "received": "8/20/2025 0:00:00",
    "price": 2.69
  },
  {
    "orderNo": 584,
    "vendor": "Kroger, Lombardi",
    "vendorOrderNo": "",
    "orderDate": "2025-08-20",
    "paymentMethod": 3005,
    "shippingMethod": "",
    "trackingNumber": "",
    "sku": 241939,
    "qty": 1,
    "received": "8/20/2025 0:00:00",
    "price": 3.39
  },
  {
    "orderNo": 593,
    "vendor": "Kroger, Lombardi",
    "vendorOrderNo": "",
    "orderDate": "2025-09-12",
    "paymentMethod": 3005,
    "shippingMethod": "",
    "trackingNumber": "",
    "sku": "000860",
    "qty": 1,
    "received": "9/8/2025 0:00:00",
    "price": 1.83
  },
  {
    "orderNo": 593,
    "vendor": "Kroger, Lombardi",
    "vendorOrderNo": "",
    "orderDate": "2025-09-12",
    "paymentMethod": 3005,
    "shippingMethod": "",
    "trackingNumber": "",
    "sku": "004011",
    "qty": 2.7,
    "received": "9/8/2025 0:00:00",
    "price": 1.78
  },
  {
    "orderNo": 593,
    "vendor": "Kroger, Lombardi",
    "vendorOrderNo": "",
    "orderDate": "2025-09-12",
    "paymentMethod": 3005,
    "shippingMethod": "",
    "trackingNumber": "",
    "sku": "004068",
    "qty": 1,
    "received": "9/8/2025 0:00:00",
    "price": 0.99
  },
  {
    "orderNo": 593,
    "vendor": "Kroger, Lombardi",
    "vendorOrderNo": "",
    "orderDate": "2025-09-12",
    "paymentMethod": 3005,
    "shippingMethod": "",
    "trackingNumber": "",
    "sku": "005158",
    "qty": 1,
    "received": "9/8/2025 0:00:00",
    "price": 3.99
  },
  {
    "orderNo": 593,
    "vendor": "Kroger, Lombardi",
    "vendorOrderNo": "",
    "orderDate": "2025-09-12",
    "paymentMethod": 3005,
    "shippingMethod": "",
    "trackingNumber": "",
    "sku": "010098",
    "qty": 1,
    "received": "9/8/2025 0:00:00",
    "price": 3.88
  },
  {
    "orderNo": 593,
    "vendor": "Kroger, Lombardi",
    "vendorOrderNo": "",
    "orderDate": "2025-09-12",
    "paymentMethod": 3005,
    "shippingMethod": "",
    "trackingNumber": "",
    "sku": "011888",
    "qty": 1,
    "received": "9/8/2025 0:00:00",
    "price": 3.19
  },
  {
    "orderNo": 593,
    "vendor": "Kroger, Lombardi",
    "vendorOrderNo": "",
    "orderDate": "2025-09-12",
    "paymentMethod": 3005,
    "shippingMethod": "",
    "trackingNumber": "",
    "sku": "013401",
    "qty": 1,
    "received": "9/8/2025 0:00:00",
    "price": 1.59
  },
  {
    "orderNo": 593,
    "vendor": "Kroger, Lombardi",
    "vendorOrderNo": "",
    "orderDate": "2025-09-12",
    "paymentMethod": 3005,
    "shippingMethod": "",
    "trackingNumber": "",
    "sku": "014604",
    "qty": 1,
    "received": "9/8/2025 0:00:00",
    "price": 2.53
  },
  {
    "orderNo": 593,
    "vendor": "Kroger, Lombardi",
    "vendorOrderNo": "",
    "orderDate": "2025-09-12",
    "paymentMethod": 3005,
    "shippingMethod": "",
    "trackingNumber": "",
    "sku": "015121",
    "qty": 1,
    "received": "9/8/2025 0:00:00",
    "price": 2.18
  },
  {
    "orderNo": 593,
    "vendor": "Kroger, Lombardi",
    "vendorOrderNo": "",
    "orderDate": "2025-09-12",
    "paymentMethod": 3005,
    "shippingMethod": "",
    "trackingNumber": "",
    "sku": "044700",
    "qty": 1,
    "received": "9/8/2025 0:00:00",
    "price": 2
  },
  {
    "orderNo": 593,
    "vendor": "Kroger, Lombardi",
    "vendorOrderNo": "",
    "orderDate": "2025-09-12",
    "paymentMethod": 3005,
    "shippingMethod": "",
    "trackingNumber": "",
    "sku": "050312",
    "qty": 1,
    "received": "9/8/2025 0:00:00",
    "price": 5.98
  },
  {
    "orderNo": 593,
    "vendor": "Kroger, Lombardi",
    "vendorOrderNo": "",
    "orderDate": "2025-09-12",
    "paymentMethod": 3005,
    "shippingMethod": "",
    "trackingNumber": "",
    "sku": "060933",
    "qty": 1,
    "received": "9/8/2025 0:00:00",
    "price": 4.28
  },
  {
    "orderNo": 593,
    "vendor": "Kroger, Lombardi",
    "vendorOrderNo": "",
    "orderDate": "2025-09-12",
    "paymentMethod": 3005,
    "shippingMethod": "",
    "trackingNumber": "",
    "sku": "089301",
    "qty": 1,
    "received": "9/8/2025 0:00:00",
    "price": 3.5
  },
  {
    "orderNo": 593,
    "vendor": "Kroger, Lombardi",
    "vendorOrderNo": "",
    "orderDate": "2025-09-12",
    "paymentMethod": 3005,
    "shippingMethod": "",
    "trackingNumber": "",
    "sku": "091487",
    "qty": 1,
    "received": "9/8/2025 0:00:00",
    "price": 1.88
  },
  {
    "orderNo": 593,
    "vendor": "Kroger, Lombardi",
    "vendorOrderNo": "",
    "orderDate": "2025-09-12",
    "paymentMethod": 3005,
    "shippingMethod": "",
    "trackingNumber": "",
    "sku": 200242,
    "qty": 1,
    "received": "9/8/2025 0:00:00",
    "price": 5.48
  },
  {
    "orderNo": 593,
    "vendor": "Kroger, Lombardi",
    "vendorOrderNo": "",
    "orderDate": "2025-09-12",
    "paymentMethod": 3005,
    "shippingMethod": "",
    "trackingNumber": "",
    "sku": 460707,
    "qty": 1,
    "received": "9/8/2025 0:00:00",
    "price": 1.99
  },
  {
    "orderNo": 593,
    "vendor": "Kroger, Lombardi",
    "vendorOrderNo": "",
    "orderDate": "2025-09-12",
    "paymentMethod": 3005,
    "shippingMethod": "",
    "trackingNumber": "",
    "sku": 758709,
    "qty": 1,
    "received": "9/8/2025 0:00:00",
    "price": 20.98
  },
  {
    "orderNo": 593,
    "vendor": "Kroger, Lombardi",
    "vendorOrderNo": "",
    "orderDate": "2025-09-12",
    "paymentMethod": 3005,
    "shippingMethod": "",
    "trackingNumber": "",
    "sku": 862006,
    "qty": 1,
    "received": "9/8/2025 0:00:00",
    "price": 1.59
  },
  {
    "orderNo": 596,
    "vendor": "Kroger, Lombardi",
    "vendorOrderNo": "",
    "orderDate": "2025-08-27",
    "paymentMethod": "",
    "shippingMethod": "",
    "trackingNumber": "",
    "sku": "000860",
    "qty": 1,
    "received": "8/28/2025 0:00:00",
    "price": 0.15
  },
  {
    "orderNo": 596,
    "vendor": "Kroger, Lombardi",
    "vendorOrderNo": "",
    "orderDate": "2025-08-27",
    "paymentMethod": "",
    "shippingMethod": "",
    "trackingNumber": "",
    "sku": "004011",
    "qty": 2.2,
    "received": "8/28/2025 0:00:00",
    "price": 1.29
  },
  {
    "orderNo": 596,
    "vendor": "Kroger, Lombardi",
    "vendorOrderNo": "",
    "orderDate": "2025-08-27",
    "paymentMethod": "",
    "shippingMethod": "",
    "trackingNumber": "",
    "sku": "050312",
    "qty": 1,
    "received": "8/28/2025 0:00:00",
    "price": 5.98
  },
  {
    "orderNo": 596,
    "vendor": "Kroger, Lombardi",
    "vendorOrderNo": "",
    "orderDate": "2025-08-27",
    "paymentMethod": "",
    "shippingMethod": "",
    "trackingNumber": "",
    "sku": "060933",
    "qty": 1,
    "received": "8/28/2025 0:00:00",
    "price": 4.28
  },
  {
    "orderNo": 596,
    "vendor": "Kroger, Lombardi",
    "vendorOrderNo": "",
    "orderDate": "2025-08-27",
    "paymentMethod": "",
    "shippingMethod": "",
    "trackingNumber": "",
    "sku": 173108,
    "qty": 1,
    "received": "8/28/2025 0:00:00",
    "price": 4.38
  },
  {
    "orderNo": 604,
    "vendor": "Kroger, Lombardi",
    "vendorOrderNo": "",
    "orderDate": "2025-08-29",
    "paymentMethod": 2466,
    "shippingMethod": "",
    "trackingNumber": "",
    "sku": "000860",
    "qty": 1,
    "received": "8/29/2025 0:00:00",
    "price": 0.2
  },
  {
    "orderNo": 604,
    "vendor": "Kroger, Lombardi",
    "vendorOrderNo": "",
    "orderDate": "2025-08-29",
    "paymentMethod": 2466,
    "shippingMethod": "",
    "trackingNumber": "",
    "sku": "007062",
    "qty": 2,
    "received": "8/29/2025 0:00:00",
    "price": 2.49
  },
  {
    "orderNo": 604,
    "vendor": "Kroger, Lombardi",
    "vendorOrderNo": "",
    "orderDate": "2025-08-29",
    "paymentMethod": 2466,
    "shippingMethod": "",
    "trackingNumber": "",
    "sku": "015201",
    "qty": 1,
    "received": "8/29/2025 0:00:00",
    "price": 4.69
  },
  {
    "orderNo": 604,
    "vendor": "Kroger, Lombardi",
    "vendorOrderNo": "",
    "orderDate": "2025-08-29",
    "paymentMethod": 2466,
    "shippingMethod": "",
    "trackingNumber": "",
    "sku": "0427052",
    "qty": 1,
    "received": "8/29/2025 0:00:00",
    "price": 1.99
  },
  {
    "orderNo": 604,
    "vendor": "Kroger, Lombardi",
    "vendorOrderNo": "",
    "orderDate": "2025-08-29",
    "paymentMethod": 2466,
    "shippingMethod": "",
    "trackingNumber": "",
    "sku": "096972",
    "qty": 1,
    "received": "8/29/2025 0:00:00",
    "price": 7.28
  },
  {
    "orderNo": 604,
    "vendor": "Kroger, Lombardi",
    "vendorOrderNo": "",
    "orderDate": "2025-08-29",
    "paymentMethod": 2466,
    "shippingMethod": "",
    "trackingNumber": "",
    "sku": 460707,
    "qty": 1,
    "received": "8/29/2025 0:00:00",
    "price": 1.99
  },
  {
    "orderNo": 604,
    "vendor": "Kroger, Lombardi",
    "vendorOrderNo": "",
    "orderDate": "2025-08-29",
    "paymentMethod": 2466,
    "shippingMethod": "",
    "trackingNumber": "",
    "sku": 898760,
    "qty": 1,
    "received": "8/29/2025 0:00:00",
    "price": 2.39
  },
  {
    "orderNo": 605,
    "vendor": "Kroger, Lombardi",
    "vendorOrderNo": "",
    "orderDate": "2025-09-01",
    "paymentMethod": "SNAP 0834",
    "shippingMethod": "",
    "trackingNumber": "",
    "sku": "000860",
    "qty": 1,
    "received": "9/2/2025 0:00:00",
    "price": 0.07
  },
  {
    "orderNo": 605,
    "vendor": "Kroger, Lombardi",
    "vendorOrderNo": "",
    "orderDate": "2025-09-01",
    "paymentMethod": "SNAP 0834",
    "shippingMethod": "",
    "trackingNumber": "",
    "sku": "060933",
    "qty": 1,
    "received": "9/2/2025 0:00:00",
    "price": 4.28
  },
  {
    "orderNo": 605,
    "vendor": "Kroger, Lombardi",
    "vendorOrderNo": "",
    "orderDate": "2025-09-01",
    "paymentMethod": "SNAP 0834",
    "shippingMethod": "",
    "trackingNumber": "",
    "sku": 502681,
    "qty": 1,
    "received": "9/2/2025 0:00:00",
    "price": 3.28
  },
  {
    "orderNo": 606,
    "vendor": "Kroger, Lombardi",
    "vendorOrderNo": "",
    "orderDate": "2025-09-03",
    "paymentMethod": "SNAP 0834",
    "shippingMethod": "",
    "trackingNumber": "",
    "sku": "004011",
    "qty": 2.2,
    "received": "9/6/2025 0:00:00",
    "price": 1.22
  },
  {
    "orderNo": 606,
    "vendor": "Kroger, Lombardi",
    "vendorOrderNo": "",
    "orderDate": "2025-09-03",
    "paymentMethod": "SNAP 0834",
    "shippingMethod": "",
    "trackingNumber": "",
    "sku": "050312",
    "qty": 1,
    "received": "9/6/2025 0:00:00",
    "price": 5.98
  },
  {
    "orderNo": 606,
    "vendor": "Kroger, Lombardi",
    "vendorOrderNo": "",
    "orderDate": "2025-09-03",
    "paymentMethod": "SNAP 0834",
    "shippingMethod": "",
    "trackingNumber": "",
    "sku": "096972",
    "qty": 1,
    "received": "9/6/2025 0:00:00",
    "price": 7.28
  },
  {
    "orderNo": 606,
    "vendor": "Kroger, Lombardi",
    "vendorOrderNo": "",
    "orderDate": "2025-09-03",
    "paymentMethod": "SNAP 0834",
    "shippingMethod": "",
    "trackingNumber": "",
    "sku": 611614,
    "qty": 1,
    "received": "9/6/2025 0:00:00",
    "price": 7.98
  },
  {
    "orderNo": 606,
    "vendor": "Kroger, Lombardi",
    "vendorOrderNo": "",
    "orderDate": "2025-09-03",
    "paymentMethod": "SNAP 0834",
    "shippingMethod": "",
    "trackingNumber": "",
    "sku": 850218,
    "qty": 1,
    "received": "9/6/2025 0:00:00",
    "price": 1.25
  },
  {
    "orderNo": 608,
    "vendor": "Kroger, Lombardi",
    "vendorOrderNo": "",
    "orderDate": "2025-09-06",
    "paymentMethod": 3005,
    "shippingMethod": "",
    "trackingNumber": "",
    "sku": "000860",
    "qty": 1,
    "received": "9/6/2025 0:00:00",
    "price": 0.05
  },
  {
    "orderNo": 608,
    "vendor": "Kroger, Lombardi",
    "vendorOrderNo": "",
    "orderDate": "2025-09-06",
    "paymentMethod": 3005,
    "shippingMethod": "",
    "trackingNumber": "",
    "sku": "004664",
    "qty": 1.6,
    "received": "9/6/2025 0:00:00",
    "price": 5.03
  },
  {
    "orderNo": 609,
    "vendor": "Kroger, Lombardi",
    "vendorOrderNo": "",
    "orderDate": "2025-09-06",
    "paymentMethod": 3005,
    "shippingMethod": "",
    "trackingNumber": "",
    "sku": "000860",
    "qty": 1,
    "received": "9/6/2025 0:00:00",
    "price": 0.05
  },
  {
    "orderNo": 609,
    "vendor": "Kroger, Lombardi",
    "vendorOrderNo": "",
    "orderDate": "2025-09-06",
    "paymentMethod": 3005,
    "shippingMethod": "",
    "trackingNumber": "",
    "sku": 200276,
    "qty": 1,
    "received": "9/6/2025 0:00:00",
    "price": 5.48
  },
  {
    "orderNo": 614,
    "vendor": "Kroger, Lombardi",
    "vendorOrderNo": "",
    "orderDate": "2025-09-13",
    "paymentMethod": 3005,
    "shippingMethod": "",
    "trackingNumber": "",
    "sku": "000860",
    "qty": 1,
    "received": "9/13/2025 0:00:00",
    "price": 0.05
  },
  {
    "orderNo": 614,
    "vendor": "Kroger, Lombardi",
    "vendorOrderNo": "",
    "orderDate": "2025-09-13",
    "paymentMethod": 3005,
    "shippingMethod": "",
    "trackingNumber": "",
    "sku": "004093",
    "qty": 0.8,
    "received": "9/13/2025 0:00:00",
    "price": 2.71
  },
  {
    "orderNo": 614,
    "vendor": "Kroger, Lombardi",
    "vendorOrderNo": "",
    "orderDate": "2025-09-13",
    "paymentMethod": 3005,
    "shippingMethod": "",
    "trackingNumber": "",
    "sku": 213505,
    "qty": 1,
    "received": "9/13/2025 0:00:00",
    "price": 2.69
  },
  {
    "orderNo": 618,
    "vendor": "Kroger, Lombardi",
    "vendorOrderNo": "",
    "orderDate": "2025-09-19",
    "paymentMethod": "",
    "shippingMethod": "",
    "trackingNumber": "",
    "sku": "000860",
    "qty": 1,
    "received": "9/26/2025 0:00:00",
    "price": 0.09
  },
  {
    "orderNo": 618,
    "vendor": "Kroger, Lombardi",
    "vendorOrderNo": "",
    "orderDate": "2025-09-19",
    "paymentMethod": "",
    "shippingMethod": "",
    "trackingNumber": "",
    "sku": "060933",
    "qty": 1,
    "received": "9/26/2025 0:00:00",
    "price": 3.99
  },
  {
    "orderNo": 618,
    "vendor": "Kroger, Lombardi",
    "vendorOrderNo": "",
    "orderDate": "2025-09-19",
    "paymentMethod": "",
    "shippingMethod": "",
    "trackingNumber": "",
    "sku": 237857,
    "qty": 1,
    "received": "9/26/2025 0:00:00",
    "price": 2.69
  },
  {
    "orderNo": 618,
    "vendor": "Kroger, Lombardi",
    "vendorOrderNo": "",
    "orderDate": "2025-09-19",
    "paymentMethod": "",
    "shippingMethod": "",
    "trackingNumber": "",
    "sku": 898760,
    "qty": 1,
    "received": "9/26/2025 0:00:00",
    "price": 2.39
  },
  {
    "orderNo": 622,
    "vendor": "Kroger, Lombardi",
    "vendorOrderNo": "",
    "orderDate": "2025-10-02",
    "paymentMethod": 5933,
    "shippingMethod": "",
    "trackingNumber": "",
    "sku": "000860",
    "qty": 1,
    "received": "10/1/2025 0:00:00",
    "price": 0.41
  },
  {
    "orderNo": 622,
    "vendor": "Kroger, Lombardi",
    "vendorOrderNo": "",
    "orderDate": "2025-10-02",
    "paymentMethod": 5933,
    "shippingMethod": "",
    "trackingNumber": "",
    "sku": "004011",
    "qty": 2.7,
    "received": "10/1/2025 0:00:00",
    "price": 1.47
  },
  {
    "orderNo": 622,
    "vendor": "Kroger, Lombardi",
    "vendorOrderNo": "",
    "orderDate": "2025-10-02",
    "paymentMethod": 5933,
    "shippingMethod": "",
    "trackingNumber": "",
    "sku": "004068",
    "qty": 1,
    "received": "10/1/2025 0:00:00",
    "price": 0.99
  },
  {
    "orderNo": 622,
    "vendor": "Kroger, Lombardi",
    "vendorOrderNo": "",
    "orderDate": "2025-10-02",
    "paymentMethod": 5933,
    "shippingMethod": "",
    "trackingNumber": "",
    "sku": "050312",
    "qty": 1,
    "received": "10/1/2025 0:00:00",
    "price": 11.97
  },
  {
    "orderNo": 622,
    "vendor": "Kroger, Lombardi",
    "vendorOrderNo": "",
    "orderDate": "2025-10-02",
    "paymentMethod": 5933,
    "shippingMethod": "",
    "trackingNumber": "",
    "sku": "060933",
    "qty": 1,
    "received": "10/1/2025 0:00:00",
    "price": 3.99
  },
  {
    "orderNo": 622,
    "vendor": "Kroger, Lombardi",
    "vendorOrderNo": "",
    "orderDate": "2025-10-02",
    "paymentMethod": 5933,
    "shippingMethod": "",
    "trackingNumber": "",
    "sku": "089301",
    "qty": 1,
    "received": "10/1/2025 0:00:00",
    "price": 3.99
  },
  {
    "orderNo": 622,
    "vendor": "Kroger, Lombardi",
    "vendorOrderNo": "",
    "orderDate": "2025-10-02",
    "paymentMethod": 5933,
    "shippingMethod": "",
    "trackingNumber": "",
    "sku": 241939,
    "qty": 1,
    "received": "10/1/2025 0:00:00",
    "price": 3.39
  },
  {
    "orderNo": 622,
    "vendor": "Kroger, Lombardi",
    "vendorOrderNo": "",
    "orderDate": "2025-10-02",
    "paymentMethod": 5933,
    "shippingMethod": "",
    "trackingNumber": "",
    "sku": 306792,
    "qty": 1,
    "received": "10/1/2025 0:00:00",
    "price": 4.48
  },
  {
    "orderNo": 622,
    "vendor": "Kroger, Lombardi",
    "vendorOrderNo": "",
    "orderDate": "2025-10-02",
    "paymentMethod": 5933,
    "shippingMethod": "",
    "trackingNumber": "",
    "sku": 460707,
    "qty": 1,
    "received": "10/1/2025 0:00:00",
    "price": 1.99
  },
  {
    "orderNo": 622,
    "vendor": "Kroger, Lombardi",
    "vendorOrderNo": "",
    "orderDate": "2025-10-02",
    "paymentMethod": 5933,
    "shippingMethod": "",
    "trackingNumber": "",
    "sku": 611614,
    "qty": 1,
    "received": "10/1/2025 0:00:00",
    "price": 8.28
  },
  {
    "orderNo": 622,
    "vendor": "Kroger, Lombardi",
    "vendorOrderNo": "",
    "orderDate": "2025-10-02",
    "paymentMethod": 5933,
    "shippingMethod": "",
    "trackingNumber": "",
    "sku": 850218,
    "qty": 1,
    "received": "10/1/2025 0:00:00",
    "price": 1.25
  },
  {
    "orderNo": 623,
    "vendor": "Kroger, Lombardi",
    "vendorOrderNo": "",
    "orderDate": "2025-10-09",
    "paymentMethod": 5933,
    "shippingMethod": "",
    "trackingNumber": "",
    "sku": "000860",
    "qty": 1,
    "received": "10/8/2025 0:00:00",
    "price": 0.1
  },
  {
    "orderNo": 623,
    "vendor": "Kroger, Lombardi",
    "vendorOrderNo": "",
    "orderDate": "2025-10-09",
    "paymentMethod": 5933,
    "shippingMethod": "",
    "trackingNumber": "",
    "sku": "004011",
    "qty": 2.3,
    "received": "10/8/2025 0:00:00",
    "price": 1.62
  },
  {
    "orderNo": 623,
    "vendor": "Kroger, Lombardi",
    "vendorOrderNo": "",
    "orderDate": "2025-10-09",
    "paymentMethod": 5933,
    "shippingMethod": "",
    "trackingNumber": "",
    "sku": "004664",
    "qty": 2.3,
    "received": "10/8/2025 0:00:00",
    "price": 4.43
  },
  {
    "orderNo": 623,
    "vendor": "Kroger, Lombardi",
    "vendorOrderNo": "",
    "orderDate": "2025-10-09",
    "paymentMethod": 5933,
    "shippingMethod": "",
    "trackingNumber": "",
    "sku": "050312",
    "qty": 1,
    "received": "10/8/2025 0:00:00",
    "price": 5.98
  },
  {
    "orderNo": 623,
    "vendor": "Kroger, Lombardi",
    "vendorOrderNo": "",
    "orderDate": "2025-10-09",
    "paymentMethod": 5933,
    "shippingMethod": "",
    "trackingNumber": "",
    "sku": "060933",
    "qty": 1,
    "received": "10/8/2025 0:00:00",
    "price": 2.99
  },
  {
    "orderNo": 623,
    "vendor": "Kroger, Lombardi",
    "vendorOrderNo": "",
    "orderDate": "2025-10-09",
    "paymentMethod": 5933,
    "shippingMethod": "",
    "trackingNumber": "",
    "sku": "089301",
    "qty": 1,
    "received": "10/8/2025 0:00:00",
    "price": 3.99
  },
  {
    "orderNo": 623,
    "vendor": "Kroger, Lombardi",
    "vendorOrderNo": "",
    "orderDate": "2025-10-09",
    "paymentMethod": 5933,
    "shippingMethod": "",
    "trackingNumber": "",
    "sku": 200276,
    "qty": 1,
    "received": "10/8/2025 0:00:00",
    "price": 4.48
  },
  {
    "orderNo": 623,
    "vendor": "Kroger, Lombardi",
    "vendorOrderNo": "",
    "orderDate": "2025-10-09",
    "paymentMethod": 5933,
    "shippingMethod": "",
    "trackingNumber": "",
    "sku": 347139,
    "qty": 1,
    "received": "10/8/2025 0:00:00",
    "price": 1.99
  },
  {
    "orderNo": 625,
    "vendor": "Kroger, Lombardi",
    "vendorOrderNo": "",
    "orderDate": "2025-10-03",
    "paymentMethod": 5933,
    "shippingMethod": "",
    "trackingNumber": "",
    "sku": "000860",
    "qty": 1,
    "received": "10/4/2025 0:00:00",
    "price": 0.33
  },
  {
    "orderNo": 625,
    "vendor": "Kroger, Lombardi",
    "vendorOrderNo": "",
    "orderDate": "2025-10-03",
    "paymentMethod": 5933,
    "shippingMethod": "",
    "trackingNumber": "",
    "sku": "004011",
    "qty": 2.4,
    "received": "10/4/2025 0:00:00",
    "price": 1.71
  },
  {
    "orderNo": 625,
    "vendor": "Kroger, Lombardi",
    "vendorOrderNo": "",
    "orderDate": "2025-10-03",
    "paymentMethod": 5933,
    "shippingMethod": "",
    "trackingNumber": "",
    "sku": "004664",
    "qty": 1.9,
    "received": "10/4/2025 0:00:00",
    "price": 4.21
  },
  {
    "orderNo": 625,
    "vendor": "Kroger, Lombardi",
    "vendorOrderNo": "",
    "orderDate": "2025-10-03",
    "paymentMethod": 5933,
    "shippingMethod": "",
    "trackingNumber": "",
    "sku": "010098",
    "qty": 1,
    "received": "10/4/2025 0:00:00",
    "price": 7.38
  },
  {
    "orderNo": 625,
    "vendor": "Kroger, Lombardi",
    "vendorOrderNo": "",
    "orderDate": "2025-10-03",
    "paymentMethod": 5933,
    "shippingMethod": "",
    "trackingNumber": "",
    "sku": 241939,
    "qty": 1,
    "received": "10/4/2025 0:00:00",
    "price": 3.39
  },
  {
    "orderNo": 625,
    "vendor": "Kroger, Lombardi",
    "vendorOrderNo": "",
    "orderDate": "2025-10-03",
    "paymentMethod": 5933,
    "shippingMethod": "",
    "trackingNumber": "",
    "sku": 318108,
    "qty": 1,
    "received": "10/4/2025 0:00:00",
    "price": 4.48
  },
  {
    "orderNo": 625,
    "vendor": "Kroger, Lombardi",
    "vendorOrderNo": "",
    "orderDate": "2025-10-03",
    "paymentMethod": 5933,
    "shippingMethod": "",
    "trackingNumber": "",
    "sku": 650191,
    "qty": 1,
    "received": "10/4/2025 0:00:00",
    "price": 5.98
  },
  {
    "orderNo": 625,
    "vendor": "Kroger, Lombardi",
    "vendorOrderNo": "",
    "orderDate": "2025-10-03",
    "paymentMethod": 5933,
    "shippingMethod": "",
    "trackingNumber": "",
    "sku": 898760,
    "qty": 2,
    "received": "10/4/2025 0:00:00",
    "price": 2.39
  },
  {
    "orderNo": 625,
    "vendor": "Kroger, Lombardi",
    "vendorOrderNo": "",
    "orderDate": "2025-10-03",
    "paymentMethod": 5933,
    "shippingMethod": "",
    "trackingNumber": "",
    "sku": 972934,
    "qty": 1,
    "received": "10/4/2025 0:00:00",
    "price": 3.49
  },
  {
    "orderNo": 627,
    "vendor": "Kroger, Lombardi",
    "vendorOrderNo": "",
    "orderDate": "2025-10-09",
    "paymentMethod": 5933,
    "shippingMethod": "",
    "trackingNumber": "",
    "sku": "004699",
    "qty": 1,
    "received": "10/10/2025 0:00:00",
    "price": 1.49
  },
  {
    "orderNo": 627,
    "vendor": "Kroger, Lombardi",
    "vendorOrderNo": "",
    "orderDate": "2025-10-09",
    "paymentMethod": 5933,
    "shippingMethod": "",
    "trackingNumber": "",
    "sku": "006138",
    "qty": 1,
    "received": "10/9/2025 0:00:00",
    "price": 6.12
  },
  {
    "orderNo": 627,
    "vendor": "Kroger, Lombardi",
    "vendorOrderNo": "",
    "orderDate": "2025-10-09",
    "paymentMethod": 5933,
    "shippingMethod": "",
    "trackingNumber": "",
    "sku": "044700",
    "qty": 1,
    "received": "10/9/2025 0:00:00",
    "price": 0
  },
  {
    "orderNo": 627,
    "vendor": "Kroger, Lombardi",
    "vendorOrderNo": "",
    "orderDate": "2025-10-09",
    "paymentMethod": 5933,
    "shippingMethod": "",
    "trackingNumber": "",
    "sku": "050312",
    "qty": 1,
    "received": "10/9/2025 0:00:00",
    "price": 5.98
  },
  {
    "orderNo": 627,
    "vendor": "Kroger, Lombardi",
    "vendorOrderNo": "",
    "orderDate": "2025-10-09",
    "paymentMethod": 5933,
    "shippingMethod": "",
    "trackingNumber": "",
    "sku": 101009,
    "qty": 1,
    "received": "10/9/2025 0:00:00",
    "price": 2.39
  },
  {
    "orderNo": 627,
    "vendor": "Kroger, Lombardi",
    "vendorOrderNo": "",
    "orderDate": "2025-10-09",
    "paymentMethod": 5933,
    "shippingMethod": "",
    "trackingNumber": "",
    "sku": 105007,
    "qty": 1,
    "received": "10/9/2025 0:00:00",
    "price": 2.39
  },
  {
    "orderNo": 627,
    "vendor": "Kroger, Lombardi",
    "vendorOrderNo": "",
    "orderDate": "2025-10-09",
    "paymentMethod": 5933,
    "shippingMethod": "",
    "trackingNumber": "",
    "sku": 241939,
    "qty": 2,
    "received": "10/9/2025 0:00:00",
    "price": 5.38
  },
  {
    "orderNo": 631,
    "vendor": "Kroger, Lombardi",
    "vendorOrderNo": "",
    "orderDate": "2025-10-19",
    "paymentMethod": 5933,
    "shippingMethod": "",
    "trackingNumber": "",
    "sku": 177963,
    "qty": 1,
    "received": "10/23/2025 0:00:00",
    "price": 1.69
  },
  {
    "orderNo": 631,
    "vendor": "Kroger, Lombardi",
    "vendorOrderNo": "",
    "orderDate": "2025-10-19",
    "paymentMethod": 5933,
    "shippingMethod": "",
    "trackingNumber": "",
    "sku": 898760,
    "qty": 2,
    "received": "10/23/2025 0:00:00",
    "price": 2.39
  },
  {
    "orderNo": 633,
    "vendor": "Kroger, Lombardi",
    "vendorOrderNo": "",
    "orderDate": "2025-10-30",
    "paymentMethod": 5933,
    "shippingMethod": "",
    "trackingNumber": "",
    "sku": "004011",
    "qty": 2,
    "received": "10/30/2025 0:00:00",
    "price": 1.47
  },
  {
    "orderNo": 633,
    "vendor": "Kroger, Lombardi",
    "vendorOrderNo": "",
    "orderDate": "2025-10-30",
    "paymentMethod": 5933,
    "shippingMethod": "",
    "trackingNumber": "",
    "sku": "004068",
    "qty": 1,
    "received": "10/30/2025 0:00:00",
    "price": 2.18
  },
  {
    "orderNo": 633,
    "vendor": "Kroger, Lombardi",
    "vendorOrderNo": "",
    "orderDate": "2025-10-30",
    "paymentMethod": 5933,
    "shippingMethod": "",
    "trackingNumber": "",
    "sku": "004664",
    "qty": 2.26,
    "received": "10/30/2025 0:00:00",
    "price": 5.33
  },
  {
    "orderNo": 633,
    "vendor": "Kroger, Lombardi",
    "vendorOrderNo": "",
    "orderDate": "2025-10-30",
    "paymentMethod": 5933,
    "shippingMethod": "",
    "trackingNumber": "",
    "sku": "007291",
    "qty": 1,
    "received": "10/30/2025 0:00:00",
    "price": 5
  },
  {
    "orderNo": 633,
    "vendor": "Kroger, Lombardi",
    "vendorOrderNo": "",
    "orderDate": "2025-10-30",
    "paymentMethod": 5933,
    "shippingMethod": "",
    "trackingNumber": "",
    "sku": "010592",
    "qty": 1,
    "received": "10/30/2025 0:00:00",
    "price": 4.98
  },
  {
    "orderNo": 633,
    "vendor": "Kroger, Lombardi",
    "vendorOrderNo": "",
    "orderDate": "2025-10-30",
    "paymentMethod": 5933,
    "shippingMethod": "",
    "trackingNumber": "",
    "sku": "015121",
    "qty": 1,
    "received": "10/30/2025 0:00:00",
    "price": 6.98
  },
  {
    "orderNo": 633,
    "vendor": "Kroger, Lombardi",
    "vendorOrderNo": "",
    "orderDate": "2025-10-30",
    "paymentMethod": 5933,
    "shippingMethod": "",
    "trackingNumber": "",
    "sku": "039779",
    "qty": 1,
    "received": "10/30/2025 0:00:00",
    "price": 6.98
  },
  {
    "orderNo": 633,
    "vendor": "Kroger, Lombardi",
    "vendorOrderNo": "",
    "orderDate": "2025-10-30",
    "paymentMethod": 5933,
    "shippingMethod": "",
    "trackingNumber": "",
    "sku": "060933",
    "qty": 1,
    "received": "10/30/2025 0:00:00",
    "price": 3.69
  },
  {
    "orderNo": 633,
    "vendor": "Kroger, Lombardi",
    "vendorOrderNo": "",
    "orderDate": "2025-10-30",
    "paymentMethod": 5933,
    "shippingMethod": "",
    "trackingNumber": "",
    "sku": "061040",
    "qty": 1,
    "received": "10/30/2025 0:00:00",
    "price": 2.49
  },
  {
    "orderNo": 633,
    "vendor": "Kroger, Lombardi",
    "vendorOrderNo": "",
    "orderDate": "2025-10-30",
    "paymentMethod": 5933,
    "shippingMethod": "",
    "trackingNumber": "",
    "sku": 611614,
    "qty": 1,
    "received": "10/30/2025 0:00:00",
    "price": 5.35
  },
  {
    "orderNo": 633,
    "vendor": "Kroger, Lombardi",
    "vendorOrderNo": "",
    "orderDate": "2025-10-30",
    "paymentMethod": 5933,
    "shippingMethod": "",
    "trackingNumber": "",
    "sku": 750100,
    "qty": 4.06,
    "received": "10/30/2025 0:00:00",
    "price": 6.06
  },
  {
    "orderNo": 633,
    "vendor": "Kroger, Lombardi",
    "vendorOrderNo": "",
    "orderDate": "2025-10-30",
    "paymentMethod": 5933,
    "shippingMethod": "",
    "trackingNumber": "",
    "sku": 850218,
    "qty": 1,
    "received": "10/30/2025 0:00:00",
    "price": 2.5
  },
  {
    "orderNo": 633,
    "vendor": "Kroger, Lombardi",
    "vendorOrderNo": "",
    "orderDate": "2025-10-30",
    "paymentMethod": 5933,
    "shippingMethod": "",
    "trackingNumber": "",
    "sku": 898760,
    "qty": 1,
    "received": "10/30/2025 0:00:00",
    "price": 4.78
  },
  {
    "orderNo": 635,
    "vendor": "Kroger, Lombardi",
    "vendorOrderNo": "",
    "orderDate": "2025-11-01",
    "paymentMethod": "Gift Card",
    "shippingMethod": "",
    "trackingNumber": "",
    "sku": "013401",
    "qty": 1,
    "received": "11/2/2025 0:00:00",
    "price": 2.5
  },
  {
    "orderNo": 635,
    "vendor": "Kroger, Lombardi",
    "vendorOrderNo": "",
    "orderDate": "2025-11-01",
    "paymentMethod": "Gift Card",
    "shippingMethod": "",
    "trackingNumber": "",
    "sku": "044150",
    "qty": 1,
    "received": "11/2/2025 0:00:00",
    "price": 7.98
  },
  {
    "orderNo": 635,
    "vendor": "Kroger, Lombardi",
    "vendorOrderNo": "",
    "orderDate": "2025-11-01",
    "paymentMethod": "Gift Card",
    "shippingMethod": "",
    "trackingNumber": "",
    "sku": "089301",
    "qty": 2,
    "received": "11/2/2025 0:00:00",
    "price": 3.99
  },
  {
    "orderNo": 635,
    "vendor": "Kroger, Lombardi",
    "vendorOrderNo": "",
    "orderDate": "2025-11-01",
    "paymentMethod": "Gift Card",
    "shippingMethod": "",
    "trackingNumber": "",
    "sku": "098535",
    "qty": 1,
    "received": "11/2/2025 0:00:00",
    "price": 3.98
  },
  {
    "orderNo": 635,
    "vendor": "Kroger, Lombardi",
    "vendorOrderNo": "",
    "orderDate": "2025-11-01",
    "paymentMethod": "Gift Card",
    "shippingMethod": "",
    "trackingNumber": "",
    "sku": 103232,
    "qty": 1,
    "received": "11/2/2025 0:00:00",
    "price": 2.42
  },
  {
    "orderNo": 635,
    "vendor": "Kroger, Lombardi",
    "vendorOrderNo": "",
    "orderDate": "2025-11-01",
    "paymentMethod": "Gift Card",
    "shippingMethod": "",
    "trackingNumber": "",
    "sku": 241939,
    "qty": 2,
    "received": "11/2/2025 0:00:00",
    "price": 6.78
  },
  {
    "orderNo": 639,
    "vendor": "Kroger, Lombardi",
    "vendorOrderNo": "",
    "orderDate": "2025-11-05",
    "paymentMethod": "Gift Card & SNAP",
    "shippingMethod": "",
    "trackingNumber": "",
    "sku": "004011",
    "qty": 2.58,
    "received": "11/5/2025 0:00:00",
    "price": 1.9
  },
  {
    "orderNo": 639,
    "vendor": "Kroger, Lombardi",
    "vendorOrderNo": "",
    "orderDate": "2025-11-05",
    "paymentMethod": "Gift Card & SNAP",
    "shippingMethod": "",
    "trackingNumber": "",
    "sku": "0427052",
    "qty": 1,
    "received": "11/5/2025 0:00:00",
    "price": 3.99
  },
  {
    "orderNo": 639,
    "vendor": "Kroger, Lombardi",
    "vendorOrderNo": "",
    "orderDate": "2025-11-05",
    "paymentMethod": "Gift Card & SNAP",
    "shippingMethod": "",
    "trackingNumber": "",
    "sku": "050312",
    "qty": 1,
    "received": "11/5/2025 0:00:00",
    "price": 5.98
  },
  {
    "orderNo": 639,
    "vendor": "Kroger, Lombardi",
    "vendorOrderNo": "",
    "orderDate": "2025-11-05",
    "paymentMethod": "Gift Card & SNAP",
    "shippingMethod": "",
    "trackingNumber": "",
    "sku": "060933",
    "qty": 1,
    "received": "11/5/2025 0:00:00",
    "price": 2.98
  },
  {
    "orderNo": 639,
    "vendor": "Kroger, Lombardi",
    "vendorOrderNo": "",
    "orderDate": "2025-11-05",
    "paymentMethod": "Gift Card & SNAP",
    "shippingMethod": "",
    "trackingNumber": "",
    "sku": 648839,
    "qty": 1,
    "received": "11/5/2025 0:00:00",
    "price": 3.5
  },
  {
    "orderNo": 644,
    "vendor": "Kroger, Lombardi",
    "vendorOrderNo": "",
    "orderDate": "2025-11-12",
    "paymentMethod": 5933,
    "shippingMethod": "",
    "trackingNumber": "",
    "sku": "002092",
    "qty": 1,
    "received": "11/16/2025 0:00:00",
    "price": 3
  },
  {
    "orderNo": 644,
    "vendor": "Kroger, Lombardi",
    "vendorOrderNo": "",
    "orderDate": "2025-11-12",
    "paymentMethod": 5933,
    "shippingMethod": "",
    "trackingNumber": "",
    "sku": "004011",
    "qty": 2.59,
    "received": "11/16/2025 0:00:00",
    "price": 1.16
  },
  {
    "orderNo": 644,
    "vendor": "Kroger, Lombardi",
    "vendorOrderNo": "",
    "orderDate": "2025-11-12",
    "paymentMethod": 5933,
    "shippingMethod": "",
    "trackingNumber": "",
    "sku": "015121",
    "qty": 1,
    "received": "11/16/2025 0:00:00",
    "price": 3.69
  },
  {
    "orderNo": 644,
    "vendor": "Kroger, Lombardi",
    "vendorOrderNo": "",
    "orderDate": "2025-11-12",
    "paymentMethod": 5933,
    "shippingMethod": "",
    "trackingNumber": "",
    "sku": "050312",
    "qty": 1,
    "received": "11/16/2025 0:00:00",
    "price": 5.98
  },
  {
    "orderNo": 644,
    "vendor": "Kroger, Lombardi",
    "vendorOrderNo": "",
    "orderDate": "2025-11-12",
    "paymentMethod": 5933,
    "shippingMethod": "",
    "trackingNumber": "",
    "sku": 433203,
    "qty": 1,
    "received": "11/16/2025 0:00:00",
    "price": 5.98
  },
  {
    "orderNo": 644,
    "vendor": "Kroger, Lombardi",
    "vendorOrderNo": "",
    "orderDate": "2025-11-12",
    "paymentMethod": 5933,
    "shippingMethod": "",
    "trackingNumber": "",
    "sku": 510719,
    "qty": 5.38,
    "received": "11/16/2025 0:00:00",
    "price": 10.7
  },
  {
    "orderNo": 644,
    "vendor": "Kroger, Lombardi",
    "vendorOrderNo": "",
    "orderDate": "2025-11-12",
    "paymentMethod": 5933,
    "shippingMethod": "",
    "trackingNumber": "",
    "sku": 611614,
    "qty": 1,
    "received": "11/16/2025 0:00:00",
    "price": 8.28
  },
  {
    "orderNo": 644,
    "vendor": "Kroger, Lombardi",
    "vendorOrderNo": "",
    "orderDate": "2025-11-12",
    "paymentMethod": 5933,
    "shippingMethod": "",
    "trackingNumber": "",
    "sku": 850218,
    "qty": 1,
    "received": "11/16/2025 0:00:00",
    "price": 1.25
  },
  {
    "orderNo": 648,
    "vendor": "Kroger, Lombardi",
    "vendorOrderNo": "",
    "orderDate": "2025-12-10",
    "paymentMethod": 5933,
    "shippingMethod": "car",
    "trackingNumber": "",
    "sku": "001987",
    "qty": 1,
    "received": "12/9/2025 0:00:00",
    "price": 4.48
  },
  {
    "orderNo": 648,
    "vendor": "Kroger, Lombardi",
    "vendorOrderNo": "",
    "orderDate": "2025-12-10",
    "paymentMethod": 5933,
    "shippingMethod": "car",
    "trackingNumber": "",
    "sku": "004065",
    "qty": 1,
    "received": "12/9/2025 0:00:00",
    "price": 1.77
  },
  {
    "orderNo": 648,
    "vendor": "Kroger, Lombardi",
    "vendorOrderNo": "",
    "orderDate": "2025-12-10",
    "paymentMethod": 5933,
    "shippingMethod": "car",
    "trackingNumber": "",
    "sku": "004504",
    "qty": 1,
    "received": "12/9/2025 0:00:00",
    "price": 1.99
  },
  {
    "orderNo": 648,
    "vendor": "Kroger, Lombardi",
    "vendorOrderNo": "",
    "orderDate": "2025-12-10",
    "paymentMethod": 5933,
    "shippingMethod": "car",
    "trackingNumber": "",
    "sku": "004664",
    "qty": 1.96,
    "received": "12/9/2025 0:00:00",
    "price": 3.32
  },
  {
    "orderNo": 648,
    "vendor": "Kroger, Lombardi",
    "vendorOrderNo": "",
    "orderDate": "2025-12-10",
    "paymentMethod": 5933,
    "shippingMethod": "car",
    "trackingNumber": "",
    "sku": "028858",
    "qty": 1,
    "received": "12/9/2025 0:00:00",
    "price": 3.58
  },
  {
    "orderNo": 648,
    "vendor": "Kroger, Lombardi",
    "vendorOrderNo": "",
    "orderDate": "2025-12-10",
    "paymentMethod": 5933,
    "shippingMethod": "car",
    "trackingNumber": "",
    "sku": "040601",
    "qty": 1,
    "received": "12/9/2025 0:00:00",
    "price": 1.88
  },
  {
    "orderNo": 648,
    "vendor": "Kroger, Lombardi",
    "vendorOrderNo": "",
    "orderDate": "2025-12-10",
    "paymentMethod": 5933,
    "shippingMethod": "car",
    "trackingNumber": "",
    "sku": "060914",
    "qty": 2,
    "received": "12/9/2025 0:00:00",
    "price": 9.89
  },
  {
    "orderNo": 648,
    "vendor": "Kroger, Lombardi",
    "vendorOrderNo": "",
    "orderDate": "2025-12-10",
    "paymentMethod": 5933,
    "shippingMethod": "car",
    "trackingNumber": "",
    "sku": "067617",
    "qty": 1,
    "received": "12/9/2025 0:00:00",
    "price": 2.39
  },
  {
    "orderNo": 648,
    "vendor": "Kroger, Lombardi",
    "vendorOrderNo": "",
    "orderDate": "2025-12-10",
    "paymentMethod": 5933,
    "shippingMethod": "car",
    "trackingNumber": "",
    "sku": "089301",
    "qty": 1,
    "received": "12/9/2025 0:00:00",
    "price": 3.28
  },
  {
    "orderNo": 648,
    "vendor": "Kroger, Lombardi",
    "vendorOrderNo": "",
    "orderDate": "2025-12-10",
    "paymentMethod": 5933,
    "shippingMethod": "car",
    "trackingNumber": "",
    "sku": "089622",
    "qty": 1,
    "received": "12/9/2025 0:00:00",
    "price": 2.19
  },
  {
    "orderNo": 648,
    "vendor": "Kroger, Lombardi",
    "vendorOrderNo": "",
    "orderDate": "2025-12-10",
    "paymentMethod": 5933,
    "shippingMethod": "car",
    "trackingNumber": "",
    "sku": "094068",
    "qty": 1,
    "received": "12/9/2025 0:00:00",
    "price": 1.78
  },
  {
    "orderNo": 648,
    "vendor": "Kroger, Lombardi",
    "vendorOrderNo": "",
    "orderDate": "2025-12-10",
    "paymentMethod": 5933,
    "shippingMethod": "car",
    "trackingNumber": "",
    "sku": 174408,
    "qty": 1,
    "received": "12/9/2025 0:00:00",
    "price": 4.38
  },
  {
    "orderNo": 648,
    "vendor": "Kroger, Lombardi",
    "vendorOrderNo": "",
    "orderDate": "2025-12-10",
    "paymentMethod": 5933,
    "shippingMethod": "car",
    "trackingNumber": "",
    "sku": 200276,
    "qty": 1,
    "received": "12/9/2025 0:00:00",
    "price": 5.48
  },
  {
    "orderNo": 648,
    "vendor": "Kroger, Lombardi",
    "vendorOrderNo": "",
    "orderDate": "2025-12-10",
    "paymentMethod": 5933,
    "shippingMethod": "car",
    "trackingNumber": "",
    "sku": 294500,
    "qty": 1,
    "received": "12/9/2025 0:00:00",
    "price": 5.48
  },
  {
    "orderNo": 648,
    "vendor": "Kroger, Lombardi",
    "vendorOrderNo": "",
    "orderDate": "2025-12-10",
    "paymentMethod": 5933,
    "shippingMethod": "car",
    "trackingNumber": "",
    "sku": 502681,
    "qty": 1,
    "received": "12/9/2025 0:00:00",
    "price": 3.28
  },
  {
    "orderNo": 648,
    "vendor": "Kroger, Lombardi",
    "vendorOrderNo": "",
    "orderDate": "2025-12-10",
    "paymentMethod": 5933,
    "shippingMethod": "car",
    "trackingNumber": "",
    "sku": 510719,
    "qty": 5.38,
    "received": "12/9/2025 0:00:00",
    "price": 11.02
  },
  {
    "orderNo": 648,
    "vendor": "Kroger, Lombardi",
    "vendorOrderNo": "",
    "orderDate": "2025-12-10",
    "paymentMethod": 5933,
    "shippingMethod": "car",
    "trackingNumber": "",
    "sku": 611614,
    "qty": 1,
    "received": "12/9/2025 0:00:00",
    "price": 8.28
  },
  {
    "orderNo": 648,
    "vendor": "Kroger, Lombardi",
    "vendorOrderNo": "",
    "orderDate": "2025-12-10",
    "paymentMethod": 5933,
    "shippingMethod": "car",
    "trackingNumber": "",
    "sku": 898760,
    "qty": 2,
    "received": "12/9/2025 0:00:00",
    "price": 2.39
  },
  {
    "orderNo": 655,
    "vendor": "Kroger, Lombardi",
    "vendorOrderNo": "",
    "orderDate": "2025-12-04",
    "paymentMethod": 5933,
    "shippingMethod": "oldmanwalking",
    "trackingNumber": "",
    "sku": "000014",
    "qty": 1,
    "received": "",
    "price": 0
  },
  {
    "orderNo": 655,
    "vendor": "Kroger, Lombardi",
    "vendorOrderNo": "",
    "orderDate": "2025-12-04",
    "paymentMethod": 5933,
    "shippingMethod": "oldmanwalking",
    "trackingNumber": "",
    "sku": "004664",
    "qty": 1.96,
    "received": "12/4/2025 0:00:00",
    "price": 2.75
  },
  {
    "orderNo": 655,
    "vendor": "Kroger, Lombardi",
    "vendorOrderNo": "",
    "orderDate": "2025-12-04",
    "paymentMethod": 5933,
    "shippingMethod": "oldmanwalking",
    "trackingNumber": "",
    "sku": "028858",
    "qty": 1,
    "received": "12/4/2025 0:00:00",
    "price": 3.58
  },
  {
    "orderNo": 663,
    "vendor": "Kroger, Lombardi",
    "vendorOrderNo": "",
    "orderDate": "2025-12-20",
    "paymentMethod": 5933,
    "shippingMethod": "oldmanwalking",
    "trackingNumber": "",
    "sku": "004011",
    "qty": 2.59,
    "received": "12/18/2025 0:00:00",
    "price": 1.42
  },
  {
    "orderNo": 663,
    "vendor": "Kroger, Lombardi",
    "vendorOrderNo": "",
    "orderDate": "2025-12-20",
    "paymentMethod": 5933,
    "shippingMethod": "oldmanwalking",
    "trackingNumber": "",
    "sku": "004504",
    "qty": 1,
    "received": "12/18/2025 0:00:00",
    "price": 1.99
  },
  {
    "orderNo": 663,
    "vendor": "Kroger, Lombardi",
    "vendorOrderNo": "",
    "orderDate": "2025-12-20",
    "paymentMethod": 5933,
    "shippingMethod": "oldmanwalking",
    "trackingNumber": "",
    "sku": "040601",
    "qty": 1,
    "received": "12/18/2025 0:00:00",
    "price": 1.88
  },
  {
    "orderNo": 663,
    "vendor": "Kroger, Lombardi",
    "vendorOrderNo": "",
    "orderDate": "2025-12-20",
    "paymentMethod": 5933,
    "shippingMethod": "oldmanwalking",
    "trackingNumber": "",
    "sku": "052013",
    "qty": 1,
    "received": "12/18/2025 0:00:00",
    "price": 5.48
  },
  {
    "orderNo": 663,
    "vendor": "Kroger, Lombardi",
    "vendorOrderNo": "",
    "orderDate": "2025-12-20",
    "paymentMethod": 5933,
    "shippingMethod": "oldmanwalking",
    "trackingNumber": "",
    "sku": 502681,
    "qty": 1,
    "received": "12/18/2025 0:00:00",
    "price": 2.99
  },
  {
    "orderNo": 664,
    "vendor": "Kroger, Lombardi",
    "vendorOrderNo": "",
    "orderDate": "2026-01-12",
    "paymentMethod": "Gift Card & 5933",
    "shippingMethod": "car",
    "trackingNumber": "",
    "sku": "004011",
    "qty": 2.59,
    "received": "1/12/2026 0:00:00",
    "price": 0.49
  },
  {
    "orderNo": 664,
    "vendor": "Kroger, Lombardi",
    "vendorOrderNo": "",
    "orderDate": "2026-01-12",
    "paymentMethod": "Gift Card & 5933",
    "shippingMethod": "car",
    "trackingNumber": "",
    "sku": "004068",
    "qty": 1,
    "received": "1/12/2026 0:00:00",
    "price": 1.78
  },
  {
    "orderNo": 664,
    "vendor": "Kroger, Lombardi",
    "vendorOrderNo": "",
    "orderDate": "2026-01-12",
    "paymentMethod": "Gift Card & 5933",
    "shippingMethod": "car",
    "trackingNumber": "",
    "sku": "004093",
    "qty": 1.14,
    "received": "1/12/2026 0:00:00",
    "price": 0.86
  },
  {
    "orderNo": 664,
    "vendor": "Kroger, Lombardi",
    "vendorOrderNo": "",
    "orderDate": "2026-01-12",
    "paymentMethod": "Gift Card & 5933",
    "shippingMethod": "car",
    "trackingNumber": "",
    "sku": "004419",
    "qty": 1,
    "received": "1/12/2026 0:00:00",
    "price": 19.48
  },
  {
    "orderNo": 664,
    "vendor": "Kroger, Lombardi",
    "vendorOrderNo": "",
    "orderDate": "2026-01-12",
    "paymentMethod": "Gift Card & 5933",
    "shippingMethod": "car",
    "trackingNumber": "",
    "sku": "004608",
    "qty": 1,
    "received": "1/12/2026 0:00:00",
    "price": 0.99
  },
  {
    "orderNo": 664,
    "vendor": "Kroger, Lombardi",
    "vendorOrderNo": "",
    "orderDate": "2026-01-12",
    "paymentMethod": "Gift Card & 5933",
    "shippingMethod": "car",
    "trackingNumber": "",
    "sku": "004664",
    "qty": 1.96,
    "received": "1/12/2026 0:00:00",
    "price": 8.64
  },
  {
    "orderNo": 664,
    "vendor": "Kroger, Lombardi",
    "vendorOrderNo": "",
    "orderDate": "2026-01-12",
    "paymentMethod": "Gift Card & 5933",
    "shippingMethod": "car",
    "trackingNumber": "",
    "sku": "004705",
    "qty": 0.44,
    "received": "1/12/2026 0:00:00",
    "price": 1.81
  },
  {
    "orderNo": 664,
    "vendor": "Kroger, Lombardi",
    "vendorOrderNo": "",
    "orderDate": "2026-01-12",
    "paymentMethod": "Gift Card & 5933",
    "shippingMethod": "car",
    "trackingNumber": "",
    "sku": "007062",
    "qty": 1,
    "received": "1/12/2026 0:00:00",
    "price": 2.58
  },
  {
    "orderNo": 664,
    "vendor": "Kroger, Lombardi",
    "vendorOrderNo": "",
    "orderDate": "2026-01-12",
    "paymentMethod": "Gift Card & 5933",
    "shippingMethod": "car",
    "trackingNumber": "",
    "sku": "011888",
    "qty": 1,
    "received": "1/12/2026 0:00:00",
    "price": 2.99
  },
  {
    "orderNo": 664,
    "vendor": "Kroger, Lombardi",
    "vendorOrderNo": "",
    "orderDate": "2026-01-12",
    "paymentMethod": "Gift Card & 5933",
    "shippingMethod": "car",
    "trackingNumber": "",
    "sku": "015121",
    "qty": 1,
    "received": "1/12/2026 0:00:00",
    "price": 6.98
  },
  {
    "orderNo": 664,
    "vendor": "Kroger, Lombardi",
    "vendorOrderNo": "",
    "orderDate": "2026-01-12",
    "paymentMethod": "Gift Card & 5933",
    "shippingMethod": "car",
    "trackingNumber": "",
    "sku": "020776",
    "qty": 1,
    "received": "1/12/2026 0:00:00",
    "price": 2.49
  },
